2022,12,9E,Endeavor Air Inc.,BHM,"Birmingham, AL: Birmingham-Shuttlesworth International",22,8,1.3,0,0.58,0,6.12,0,0,338,61,0,45,0,
2022,12,9E,Endeavor Air Inc.,BNA,"Nashville, TN: Nashville International",175,26,11.07,0,6.42,0,8.51,8,0,1292,566,0,269,0,
2022,12,9E,Endeavor Air Inc.,BQK,"Brunswick, GA: Brunswick Golden Isles",60,14,10.1,2.21,1.45,0,0.24,0,0,923,662,112,131,0,
2022,12,9E,Endeavor Air Inc.,BTR,"Baton Rouge, LA: Baton Rouge Metropolitan/Ryan Field",37,6,1.79,0,2.11,0,2.1,0,0,355,161,0,69,0,
2022,12,9E,Endeavor Air Inc.,BTV,"Burlington, VT: Burlington International",151,26,9.8,0.96,8.48,0,6.76,10,0,1870,671,463,300,0,
2022,12,9E,Endeavor Air Inc.,BUF,"Buffalo, NY: Buffalo Niagara International",236,33,9.36,0.14,4.33,0,19.18,28,0,1895,802,11,162,0,
2022,12,9E,Endeavor Air Inc.,BWI,"Baltimore, MD: Baltimore/Washington International Thurgood Marshall",61,9,2.48,1,2.17,0,3.35,1,0,953,155,579,69,0,
2022,12,9E,Endeavor Air Inc.,CAE,"Columbia, SC: Columbia Metropolitan",49,12,3.36,0.33,3.53,0,4.77,0,0,642,171,20,157,0,
2022,12,9E,Endeavor Air Inc.,CHA,"Chattanooga, TN: Lovell Field",74,9,2.94,0,2.78,0,3.28,1,0,331,170,0,71,0,
2022,12,9E,Endeavor Air Inc.,CHO,"Charlottesville, VA: Charlottesville Albemarle",135,16,6.12,0,2.19,1,6.69,3,1,888,324,0,87,56,
2022,12,9E,Endeavor Air Inc.,CHS,"Charleston, SC: Charleston AFB/International",134,21,9.24,0,5.29,0,6.47,4,0,1175,629,0,228,0,
2022,12,9E,Endeavor Air Inc.,CID,"Cedar Rapids/Iowa City, IA: The Eastern Iowa",59,14,6.05,0.83,4.61,0,2.5,1,0,1023,466,72,260,0,
2022,12,9E,Endeavor Air Inc.,CLE,"Cleveland, OH: Cleveland-Hopkins International",170,22,6.42,0,4.01,0,11.57,12,1,1237,589,0,144,0,
2022,12,9E,Endeavor Air Inc.,CLT,"Charlotte, NC: Charlotte Douglas International",216,33,11.97,0,9.52,0,11.51,6,1,1545,799,0,268,0,
2022,12,9E,Endeavor Air Inc.,CMH,"Columbus, OH: John Glenn Columbus International",70,9,4.71,0,1.11,0,3.19,1,0,542,371,0,26,0,
2022,12,9E,Endeavor Air Inc.,CRW,"Charleston/Dunbar, WV: West Virginia International Yeager",71,6,4.12,0,1.81,0,0.07,1,0,427,320,0,105,0,
2022,12,9E,Endeavor Air Inc.,CSG,"Columbus, GA: Columbus Airport",71,12,6.39,2.94,1.17,0,1.5,2,1,3521,917,2474,37,0,
2022,12,9E,Endeavor Air Inc.,CVG,"Cincinnati, OH: Cincinnati/Northern Kentucky International",487,111,44.09,2.45,26.31,0,38.15,14,0,6892,2396,899,984,0,
2022,12,9E,Endeavor Air Inc.,CWA,"Mosinee, WI: Central Wisconsin",59,19,2.86,1,12.81,0,2.33,3,0,1906,357,804,547,0,
2022,12,9E,Endeavor Air Inc.,DAY,"Dayton, OH: James M Cox/Dayton International",58,11,7.43,0,1.29,0,2.28,0,0,415,303,0,37,0,
2022,12,9E,Endeavor Air Inc.,DCA,"Washington, DC: Ronald Reagan Washington National",129,26,4.38,0.9,13.6,0,7.13,1,0,1242,255,126,485,0,
2022,12,9E,Endeavor Air Inc.,DHN,"Dothan, AL: Dothan Regional",60,8,3.23,1.33,1.39,0,2.05,0,0,625,215,202,108,0,
2022,12,9E,Endeavor Air Inc.,DLH,"Duluth, MN: Duluth International",18,6,0.06,2,2.09,0,1.85,0,0,1071,2,909,90,0,
2022,12,9E,Endeavor Air Inc.,DSM,"Des Moines, IA: Des Moines International",181,35,10.72,3.57,12.72,0,7.99,4,0,3954,2324,279,632,0,
2022,12,9E,Endeavor Air Inc.,DTW,"Detroit, MI: Detroit Metro Wayne County",1448,186,66.06,8.79,40.58,0,70.57,82,1,16856,7817,1840,1751,0,
2022,12,9E,Endeavor Air Inc.,EVV,"Evansville, IN: Evansville Regional",30,5,1.99,0,1.91,0,1.11,0,0,333,171,0,88,0,
2022,12,9E,Endeavor Air Inc.,EWR,"Newark, NJ: Newark Liberty International",74,21,1.44,1.31,16.72,0,1.53,1,1,1231,116,71,959,0,
2022,12,9E,Endeavor Air Inc.,EYW,"Key West, FL: Key West International",27,5,1.34,1.98,0.69,0,0.98,0,0,2068,71,1828,80,0,
2022,12,9E,Endeavor Air Inc.,FAY,"Fayetteville, NC: Fayetteville Regional/Grannis Field",14,1,0.1,0,0,0,0.9,0,0,42,4,0,0,0,
2022,12,9E,Endeavor Air Inc.,FSD,"Sioux Falls, SD: Joe Foss Field",47,10,2.24,2,5.76,0,0,4,0,1221,142,815,264,0,
2022,12,9E,Endeavor Air Inc.,GNV,"Gainesville, FL: Gainesville Regional",27,6,4.97,0,0.27,0,0.76,0,0,264,221,0,7,0,
2022,12,9E,Endeavor Air Inc.,GPT,"Gulfport/Biloxi, MS: Gulfport-Biloxi International",12,1,0,0,1,0,0,0,0,20,0,0,20,0,
2022,12,9E,Endeavor Air Inc.,GRB,"Green Bay, WI: Green Bay Austin Straubel International",121,20,8.03,1.57,9.26,0,1.14,5,0,2385,1073,597,480,0,
2022,12,9E,Endeavor Air Inc.,GRR,"Grand Rapids, MI: Gerald R. Ford International",40,16,4.05,0,5.15,0,6.79,3,0,648,237,0,140,0,
2022,12,9E,Endeavor Air Inc.,GSO,"Greensboro/High Point, NC: Piedmont Triad International",75,20,5.98,0,3.6,0,10.41,3,0,1175,303,0,159,0,
2022,12,9E,Endeavor Air Inc.,GSP,"Greer, SC: Greenville-Spartanburg International",93,16,5.43,0,1.92,0,8.66,3,0,732,235,0,102,0,
2022,12,9E,Endeavor Air Inc.,GTR,"Columbus, MS: Golden Triangle Regional",87,9,4,0,0.58,0,4.42,0,0,1237,835,0,29,0,
2022,12,9E,Endeavor Air Inc.,HPN,"White Plains, NY: Westchester County",14,2,0,0.56,1,0,0.44,0,1,240,0,91,77,0,
2022,12,9E,Endeavor Air Inc.,IAD,"Washington, DC: Washington Dulles International",37,5,2,0,1.41,0,1.59,0,0,315,46,0,68,0,
2022,12,9E,Endeavor Air Inc.,ICT,"Wichita, KS: Wichita Dwight D Eisenhower National",1,0,0,0,0,0,0,0,0,0,0,0,0,0,
2022,12,9E,Endeavor Air Inc.,ILM,"Wilmington, NC: Wilmington International",121,10,2.24,1.27,3.73,0,2.76,0,0,688,212,182,162,0,
2022,12,9E,Endeavor Air Inc.,IND,"Indianapolis, IN: Indianapolis International",148,23,7.43,0,5.38,0,10.19,6,0,1416,546,0,200,0,
2022,12,9E,Endeavor Air Inc.,ITH,"Ithaca/Cortland, NY: Ithaca Tompkins International",31,4,2.26,0,1.07,0,0.67,1,0,165,100,0,43,0,
2022,12,9E,Endeavor Air Inc.,JAN,"Jackson/Vicksburg, MS: Jackson Medgar Wiley Evers International",14,2,1.27,0,0.19,0,0.54,0,0,114,71,0,11,0,
2022,12,9E,Endeavor Air Inc.,JAX,"Jacksonville, FL: Jacksonville International",52,9,3.19,0,3.14,0,2.67,1,0,395,91,0,139,0,
2022,12,9E,Endeavor Air Inc.,JFK,"New York, NY: John F. Kennedy International",1847,365,84.28,18.82,200.73,1,60.16,75,0,29271,9411,5021,10486,49,
2022,12,9E,Endeavor Air Inc.,LAN,"Lansing, MI: Capital Region International",62,4,0.74,0.88,1.54,0,0.84,4,0,303,103,78,63,0,
2022,12,9E,Endeavor Air Inc.,LEX,"Lexington, KY: Blue Grass",97,16,5.56,0.01,5.97,0,4.46,3,1,1056,474,2,215,0,
2022,12,9E,Endeavor Air Inc.,LGA,"New York, NY: LaGuardia",2603,533,78.81,25.38,339.55,0,89.25,113,6,38931,7828,5584,17780,0,
2022,12,9E,Endeavor Air Inc.,LSE,"La Crosse, WI: La Crosse Regional",31,5,2.28,0,1.31,0,1.41,0,1,735,513,0,129,0,
2022,12,9E,Endeavor Air Inc.,MBS,"Saginaw/Bay City/Midland, MI: MBS International",62,5,1.72,0,3.28,0,0,3,0,133,49,0,84,0,
2022,12,9E,Endeavor Air Inc.,MCI,"Kansas City, MO: Kansas City International",34,7,2.44,0,2.04,0,2.52,1,0,1426,304,0,910,0,
2022,12,9E,Endeavor Air Inc.,MDW,"Chicago, IL: Chicago Midway International",60,12,4.19,2.15,2.48,0,3.17,5,0,931,409,160,133,0,
2022,12,9E,Endeavor Air Inc.,MEM,"Memphis, TN: Memphis International",65,11,5.26,0.77,2.36,0,2.6,2,0,689,263,48,125,0,
2022,12,9E,Endeavor Air Inc.,MGM,"Montgomery, AL: Montgomery Regional",104,19,9.85,3.65,2.99,0,2.51,0,1,1505,659,648,89,0,
2022,12,9E,Endeavor Air Inc.,MIA,"Miami, FL: Miami International",3,0,0,0,0,0,0,0,0,0,0,0,0,0,
2022,12,9E,Endeavor Air Inc.,MKE,"Milwaukee, WI: General Mitchell International",92,18,7.59,0,4.85,0,5.57,4,0,1185,576,0,252,0,
2022,12,9E,Endeavor Air Inc.,MLU,"Monroe, LA: Monroe Regional",62,6,5,0,1,0,0,0,1,282,259,0,23,0,
2022,12,9E,Endeavor Air Inc.,MOB,"Mobile, AL: Mobile Regional",54,6,2.09,1.44,1,0,1.47,0,0,240,48,84,17,0,
2022,12,9E,Endeavor Air Inc.,MOT,"Minot, ND: Minot International",15,3,1.78,0,1.19,0,0.04,1,0,331,264,0,58,0,
2022,12,9E,Endeavor Air Inc.,MQT,"Marquette, MI: Sawyer International",31,2,1.95,0,0.05,0,0,3,0,173,169,0,4,0,
2022,12,9E,Endeavor Air Inc.,MSN,"Madison, WI: Dane County Regional-Truax Field",32,2,1,0,0.13,0,0.87,0,0,57,18,0,5,0,
2022,12,9E,Endeavor Air Inc.,MSP,"Minneapolis, MN: Minneapolis-St Paul International",719,125,33,13.81,38.58,0,39.61,31,1,13070,3296,2548,1613,0,
2022,12,9E,Endeavor Air Inc.,MSY,"New Orleans, LA: Louis Armstrong New Orleans International",2,1,1,0,0,0,0,0,0,20,20,0,0,0,
2022,12,9E,Endeavor Air Inc.,MYR,"Myrtle Beach, SC: Myrtle Beach International",57,10,2.91,0,3.58,0,3.51,0,1,568,341,0,100,0,
2022,12,9E,Endeavor Air Inc.,OKC,"Oklahoma City, OK: Will Rogers World",20,5,2.76,0,1.18,0,1.06,0,0,156,71,0,19,0,
2022,12,9E,Endeavor Air Inc.,OMA,"Omaha, NE: Eppley Airfield",31,14,4.12,0,6.2,0,3.67,1,0,719,196,0,250,0,
2022,12,9E,Endeavor Air Inc.,ORD,"Chicago, IL: Chicago O'Hare International",70,11,2.86,1.28,5.23,0,1.62,2,0,557,75,88,186,0,
2022,12,9E,Endeavor Air Inc.,ORF,"Norfolk, VA: Norfolk International",200,23,6.13,0.84,7.86,0,8.17,6,2,1499,546,61,341,0,
2022,12,9E,Endeavor Air Inc.,ORH,"Worcester, MA: Worcester Regional",20,6,2,0,0.42,0,3.58,0,0,443,291,0,16,0,
2022,12,9E,Endeavor Air Inc.,PHL,"Philadelphia, PA: Philadelphia International",15,3,0.77,0.56,0.79,0,0.89,1,0,285,36,48,46,0,
2022,12,9E,Endeavor Air Inc.,PIT,"Pittsburgh, PA: Pittsburgh International",160,26,8.07,0.92,8.32,0,8.69,7,0,1380,712,67,214,0,
2022,12,9E,Endeavor Air Inc.,PVD,"Providence, RI: Rhode Island Tf Green International",112,25,10.35,0,3.83,0,10.82,6,0,1203,492,0,157,0,
2022,12,9E,Endeavor Air Inc.,PWM,"Portland, ME: Portland International Jetport",147,31,8.86,1,14.68,0,6.46,6,0,1959,648,543,344,0,
2022,12,9E,Endeavor Air Inc.,RDU,"Raleigh/Durham, NC: Raleigh-Durham International",448,90,32.79,3.39,20.81,0,33.01,15,0,4740,1712,241,705,0,
2022,12,9E,Endeavor Air Inc.,RIC,"Richmond, VA: Richmond International",189,31,10.62,1.75,4.93,0,13.71,5,0,1901,871,54,180,0,
2022,12,9E,Endeavor Air Inc.,ROA,"Roanoke, VA: Roanoke Blacksburg Regional",79,10,2.22,1,0.17,0,6.61,1,0,830,259,60,16,0,
2022,12,9E,Endeavor Air Inc.,ROC,"Rochester, NY: Frederick Douglass Grtr Rochester International",258,41,11.09,1.4,8.14,0,20.37,15,1,2950,667,36,621,0,
2022,12,9E,Endeavor Air Inc.,RST,"Rochester, MN: Rochester International",16,1,1,0,0,0,0,0,0,173,173,0,0,0,
2022,12,9E,Endeavor Air Inc.,SAV,"Savannah, GA: Savannah/Hilton Head International",133,29,6.73,0,10.35,0,11.92,4,0,1466,551,0,354,0,
2022,12,9E,Endeavor Air Inc.,SDF,"Louisville, KY: Louisville Muhammad Ali International",15,6,2.21,0.57,2.16,0,1.06,1,0,373,248,16,84,0,
2022,12,9E,Endeavor Air Inc.,SHV,"Shreveport, LA: Shreveport Regional",42,6,1.79,0,0.74,0,3.48,0,0,217,82,0,18,0,
2022,12,9E,Endeavor Air Inc.,STL,"St. Louis, MO: St Louis Lambert International",148,33,11.92,2.48,12.1,0,6.5,6,2,3339,1338,845,477,0,
2022,12,9E,Endeavor Air Inc.,SYR,"Syracuse, NY: Syracuse Hancock International",255,47,11.91,1.63,15.81,0,17.65,11,1,2568,602,192,629,0,
2022,12,9E,Endeavor Air Inc.,TRI,"Bristol/Johnson City/Kingsport, TN: Tri Cities",49,8,2.82,0,1.26,0,3.92,0,0,286,124,0,32,0,
2022,12,9E,Endeavor Air Inc.,TVC,"Traverse City, MI: Cherry Capital",46,14,4.16,1.31,7.48,0,1.05,4,0,683,259,95,302,0,
2022,12,9E,Endeavor Air Inc.,TYS,"Knoxville, TN: McGhee Tyson",185,37,14.4,2.13,6.71,0,13.77,3,2,3571,1734,644,294,0,
2022,12,9E,Endeavor Air Inc.,VLD,"Valdosta, GA: Valdosta Regional",76,10,5.88,0,2.41,0,1.71,0,0,1720,1584,0,78,0,
2022,12,9E,Endeavor Air Inc.,XNA,"Fayetteville, AR: Northwest Arkansas National",90,12,7.16,0.21,3.05,0,1.59,2,0,949,421,7,94,0,
2022,12,AA,American Airlines Inc.,ABQ,"Albuquerque, NM: Albuquerque International Sunport",238,77,24.68,7.19,10.23,0.4,34.5,1,1,4137,1500,390,405,12,
2022,12,AA,American Airlines Inc.,ALB,"Albany, NY: Albany International",85,23,7.36,0,4.26,0,11.39,1,2,2557,1209,0,168,0,
2022,12,AA,American Airlines Inc.,AMA,"Amarillo, TX: Rick Husband Amarillo International",31,19,6.73,1.06,0.95,0,10.27,0,0,1246,315,87,44,0,
2022,12,AA,American Airlines Inc.,ANC,"Anchorage, AK: Ted Stevens Anchorage International",31,20,4.39,1.82,11.59,0,2.2,1,0,2031,1129,259,401,0,
2022,12,AA,American Airlines Inc.,ATL,"Atlanta, GA: Hartsfield-Jackson Atlanta International",523,187,65.89,9.09,29.23,0.06,82.72,8,0,15998,6270,793,1287,7,
2022,12,AA,American Airlines Inc.,AUS,"Austin, TX: Austin - Bergstrom International",1333,502,130.53,11.44,154.88,3.34,201.81,18,1,38510,12223,1097,7139,125,
2022,12,AA,American Airlines Inc.,AVL,"Asheville, NC: Asheville Regional",91,31,10.88,1,4.11,0,15.01,1,0,3559,1682,482,106,0,
2022,12,AA,American Airlines Inc.,AVP,"Scranton/Wilkes-Barre, PA: Wilkes Barre Scranton International",73,22,8.14,0,1.69,0,12.17,1,1,3018,1357,0,49,0,
2022,12,AA,American Airlines Inc.,BDL,"Hartford, CT: Bradley International",230,65,19.68,4.66,6.98,0.03,33.65,2,0,4012,915,273,225,6,
2022,12,AA,American Airlines Inc.,BFL,"Bakersfield, CA: Meadows Field",59,30,13.04,3.67,3.44,0,9.85,2,0,2812,621,903,97,0,
2022,12,AA,American Airlines Inc.,BHM,"Birmingham, AL: Birmingham-Shuttlesworth International",102,42,16.12,3.93,5.6,0,16.35,1,0,5763,2903,212,255,0,
2022,12,AA,American Airlines Inc.,BNA,"Nashville, TN: Nashville International",664,213,62.24,8.12,46.02,0.15,96.48,20,1,13935,4172,510,2385,16,
2022,12,AA,American Airlines Inc.,BOI,"Boise, ID: Boise Air Terminal",105,38,11.15,2.4,13.34,0,11.11,1,0,1736,377,296,371,0,
2022,12,AA,American Airlines Inc.,BOS,"Boston, MA: Logan International",1453,353,120.87,4.78,81.01,0.31,146.03,30,1,28357,9553,522,3210,5,
2022,12,AA,American Airlines Inc.,BUF,"Buffalo, NY: Buffalo Niagara International",119,36,15.72,0,2.97,0,17.31,23,0,3077,1674,0,77,0,
2022,12,AA,American Airlines Inc.,BUR,"Burbank, CA: Bob Hope",124,40,11.07,1.16,15.08,0,12.69,1,7,2130,714,76,468,0,
2022,12,AA,American Airlines Inc.,BWI,"Baltimore, MD: Baltimore/Washington International Thurgood Marshall",252,85,32.04,4.8,12.48,0.87,34.8,1,0,6454,1894,405,495,20,
2022,12,AA,American Airlines Inc.,BZN,"Bozeman, MT: Bozeman Yellowstone International",64,23,5.65,1.47,10.22,0,5.66,3,0,1636,284,200,450,0,
2022,12,AA,American Airlines Inc.,CAE,"Columbia, SC: Columbia Metropolitan",59,35,10,0.92,4.24,0,19.83,2,0,3109,1118,121,200,0,
2022,12,AA,American Airlines Inc.,CHS,"Charleston, SC: Charleston AFB/International",377,112,34.56,2.66,22.43,0,52.34,8,0,7359,2014,160,676,0,
2022,12,AA,American Airlines Inc.,CID,"Cedar Rapids/Iowa City, IA: The Eastern Iowa",104,42,14.64,0.29,8.67,0,18.4,6,0,3314,1586,10,378,0,
2022,12,AA,American Airlines Inc.,CLE,"Cleveland, OH: Cleveland-Hopkins International",324,100,29.9,3.59,21.22,1.11,44.18,20,0,6078,2094,313,800,50,
2022,12,AA,American Airlines Inc.,CLT,"Charlotte, NC: Charlotte Douglas International",10008,2182,629.82,61.24,449.54,8.45,1032.95,155,24,208303,83323,7016,16291,305,
2022,12,AA,American Airlines Inc.,CMH,"Columbus, OH: John Glenn Columbus International",333,117,33.31,2.48,21.54,0.05,59.63,14,0,8913,2733,100,918,6,
2022,12,AA,American Airlines Inc.,COS,"Colorado Springs, CO: City of Colorado Springs Municipal",88,21,7.95,1.58,3.77,0,7.7,1,1,1395,621,104,113,0,
2022,12,AA,American Airlines Inc.,CVG,"Cincinnati, OH: Cincinnati/Northern Kentucky International",215,57,12.28,3.15,12.99,0,28.58,6,0,4033,1218,251,475,0,
2022,12,AA,American Airlines Inc.,DAB,"Daytona Beach, FL: Daytona Beach International",77,25,8.38,0,2.53,0,14.08,0,0,3070,1343,0,66,0,
2022,12,AA,American Airlines Inc.,DCA,"Washington, DC: Ronald Reagan Washington National",2634,659,174.2,13.95,140.69,2.54,327.62,47,7,58313,15111,1884,5030,110,
2022,12,AA,American Airlines Inc.,DEN,"Denver, CO: Denver International",672,222,66.78,11.07,52.81,1.63,89.71,9,0,14692,3816,1280,1897,55,
2022,12,AA,American Airlines Inc.,DFW,"Dallas/Fort Worth, TX: Dallas/Fort Worth International",12352,3370,909.02,160.25,752.72,10.35,1537.66,228,22,323449,109989,17848,36628,331,
2022,12,AA,American Airlines Inc.,DSM,"Des Moines, IA: Des Moines International",181,66,20.04,2.34,19.72,0,23.91,8,0,4389,985,184,960,0,
2022,12,AA,American Airlines Inc.,DTW,"Detroit, MI: Detroit Metro Wayne County",316,75,28.14,3.55,6.72,0,36.59,9,0,6821,3376,232,305,0,
2022,12,AA,American Airlines Inc.,ECP,"Panama City, FL: Northwest Florida Beaches International",31,8,4.78,0,0.45,0,2.77,0,0,322,187,0,19,0,
2022,12,AA,American Airlines Inc.,EGE,"Eagle, CO: Eagle County Regional",146,52,13.08,5.48,20.87,0,12.57,5,1,4027,903,611,1184,0,
2022,12,AA,American Airlines Inc.,ELP,"El Paso, TX: El Paso International",180,68,22.52,5.94,7.44,0,32.09,1,0,4089,1160,565,348,0,
2022,12,AA,American Airlines Inc.,EUG,"Eugene, OR: Mahlon Sweet Field",61,25,6.79,0.38,6.85,0,10.98,1,1,1789,352,28,287,0,
2022,12,AA,American Airlines Inc.,EWR,"Newark, NJ: Newark Liberty International",671,237,60.66,9.75,79.51,0.45,86.63,6,2,17083,5029,755,3864,49,
2022,12,AA,American Airlines Inc.,EYW,"Key West, FL: Key West International",196,59,15.2,1.05,17.99,0,24.76,1,4,4442,1060,39,792,0,
2022,12,AA,American Airlines Inc.,FAT,"Fresno, CA: Fresno Yosemite International",139,44,17.56,2.43,10.48,0,13.53,1,0,3685,1532,224,371,0,
2022,12,AA,American Airlines Inc.,FLL,"Fort Lauderdale, FL: Fort Lauderdale-Hollywood International",527,169,46.85,6.55,38,1.27,76.33,5,0,10399,2832,453,1483,96,
2022,12,AA,American Airlines Inc.,GEG,"Spokane, WA: Spokane International",62,26,11.26,0.21,4.22,0,10.31,0,0,2097,1342,21,138,0,
2022,12,AA,American Airlines Inc.,GRB,"Green Bay, WI: Green Bay Austin Straubel International",4,2,0,0,0,0,2,0,0,359,1,0,0,0,
2022,12,AA,American Airlines Inc.,GRR,"Grand Rapids, MI: Gerald R. Ford International",147,49,17.83,0.07,6.88,0,24.23,8,0,3783,1144,10,302,0,
2022,12,AA,American Airlines Inc.,GSO,"Greensboro/High Point, NC: Piedmont Triad International",144,47,17.93,1,7.62,0,20.46,4,0,2974,1093,56,329,0,
2022,12,AA,American Airlines Inc.,GSP,"Greer, SC: Greenville-Spartanburg International",133,36,14.72,1.51,5.01,0,14.77,1,0,2716,1229,49,236,0,
2022,12,AA,American Airlines Inc.,GUC,"Gunnison, CO: Gunnison-Crested Butte Regional",14,5,0.25,0,0.1,0,4.65,0,0,719,61,0,8,0,
2022,12,AA,American Airlines Inc.,HDN,"Hayden, CO: Yampa Valley",34,4,2.52,0,0.65,0,0.82,0,0,165,122,0,15,0,
2022,12,AA,American Airlines Inc.,HNL,"Honolulu, HI: Daniel K Inouye International",217,66,17.79,2.19,31,0,15.01,0,0,3894,1221,132,1024,0,
2022,12,AA,American Airlines Inc.,IAD,"Washington, DC: Washington Dulles International",133,45,9.78,2.51,7.97,0.62,24.12,0,0,2787,467,151,250,45,
2022,12,AA,American Airlines Inc.,IAH,"Houston, TX: George Bush Intercontinental/Houston",451,137,49.23,8,27.96,3.89,47.92,5,0,9372,3409,777,1109,212,
2022,12,AA,American Airlines Inc.,ICT,"Wichita, KS: Wichita Dwight D Eisenhower National",88,39,9.28,1.09,1.44,0,27.19,4,0,3528,621,71,89,0,
2022,12,AA,American Airlines Inc.,ILM,"Wilmington, NC: Wilmington International",183,61,18.01,0.11,5.76,0.13,36.99,2,0,5769,1394,10,298,10,
2022,12,AA,American Airlines Inc.,IND,"Indianapolis, IN: Indianapolis International",382,112,28.83,1.53,43.28,0.09,38.27,12,2,8559,2424,98,2306,2,
2022,12,AA,American Airlines Inc.,JAC,"Jackson, WY: Jackson Hole",83,30,6.98,3.51,7.98,0,11.52,0,5,2386,512,133,577,0,
2022,12,AA,American Airlines Inc.,JAX,"Jacksonville, FL: Jacksonville International",484,144,49.75,5.84,20.07,1.99,66.35,3,0,10248,2964,576,918,43,
2022,12,AA,American Airlines Inc.,JFK,"New York, NY: John F. Kennedy International",1152,309,93.86,11.01,94.05,0,110.08,8,2,23344,8668,987,4272,0,
2022,12,AA,American Airlines Inc.,KOA,"Kona, HI: Ellison Onizuka Kona International at Keahole",79,13,3.59,0,4.97,0,4.44,0,1,572,148,0,157,0,
2022,12,AA,American Airlines Inc.,LAS,"Las Vegas, NV: Harry Reid International",1046,343,108.98,14.88,100.97,1.21,116.96,17,1,23162,8322,1007,3580,79,
2022,12,AA,American Airlines Inc.,LAX,"Los Angeles, CA: Los Angeles International",2512,682,227.25,25.74,237.97,1.56,189.49,20,6,51387,20003,2661,8515,80,
2022,12,AA,American Airlines Inc.,LGA,"New York, NY: LaGuardia",1745,531,142.69,17.67,175.36,1,194.28,43,4,37782,9707,1205,7963,21,
2022,12,AA,American Airlines Inc.,LIH,"Lihue, HI: Lihue Airport",79,17,7.27,0,3.09,0,6.64,0,1,822,336,0,77,0,
2022,12,AA,American Airlines Inc.,LIT,"Little Rock, AR: Bill and Hillary Clinton Nat Adams Field",102,33,12.21,1.26,2.35,0,17.18,1,0,3110,957,156,182,0,
2022,12,AA,American Airlines Inc.,MCI,"Kansas City, MO: Kansas City International",473,121,39.47,4.3,16.51,1.07,59.66,5,0,6583,2005,250,679,47,
2022,12,AA,American Airlines Inc.,MCO,"Orlando, FL: Orlando International",1510,464,153.58,13.48,107.43,3.34,186.17,15,3,33994,12647,1306,4535,211,
2022,12,AA,American Airlines Inc.,MDT,"Harrisburg, PA: Harrisburg International",92,32,13.77,1.05,3.3,0,13.88,2,0,4270,1794,22,103,0,
2022,12,AA,American Airlines Inc.,MEM,"Memphis, TN: Memphis International",305,114,31.29,4.8,18.39,1.39,58.13,4,0,8652,2499,410,809,38,
2022,12,AA,American Airlines Inc.,MFE,"Mission/McAllen/Edinburg, TX: McAllen Miller International",132,45,23.11,4.23,7.82,0,9.84,1,0,2469,1012,445,326,0,
2022,12,AA,American Airlines Inc.,MIA,"Miami, FL: Miami International",4160,956,372.07,38.18,252.06,4.27,289.42,23,9,70992,30634,3823,8822,185,
2022,12,AA,American Airlines Inc.,MKE,"Milwaukee, WI: General Mitchell International",181,55,20.88,3.96,10.27,1,18.89,1,1,3554,1612,243,306,48,
2022,12,AA,American Airlines Inc.,MSN,"Madison, WI: Dane County Regional-Truax Field",153,69,19.07,1.67,7.54,0,40.72,3,1,5967,1290,65,301,0,
2022,12,AA,American Airlines Inc.,MSO,"Missoula, MT: Missoula Montana",31,8,3.03,1.65,2.27,0,1.05,2,0,448,173,46,98,0,
2022,12,AA,American Airlines Inc.,MSP,"Minneapolis, MN: Minneapolis-St Paul International",314,86,31.78,4.81,10.01,0,39.4,5,1,5677,1683,367,350,0,
2022,12,AA,American Airlines Inc.,MSY,"New Orleans, LA: Louis Armstrong New Orleans International",505,145,47.01,9.49,31.02,0.37,57.12,6,3,10099,3339,1386,1385,58,
2022,12,AA,American Airlines Inc.,MTJ,"Montrose/Delta, CO: Montrose Regional",51,18,6.57,0.57,1.97,0,8.89,0,0,1583,414,22,73,0,
2022,12,AA,American Airlines Inc.,MYR,"Myrtle Beach, SC: Myrtle Beach International",72,23,6.65,0,3.04,0,13.31,1,0,1597,863,0,83,0,
2022,12,AA,American Airlines Inc.,OGG,"Kahului, HI: Kahului Airport",186,57,12.98,4.01,27.85,0,12.16,1,3,3327,814,408,1170,0,
2022,12,AA,American Airlines Inc.,OKC,"Oklahoma City, OK: Will Rogers World",237,71,24.83,8.69,5.5,0,31.98,3,0,5931,2342,894,228,0,
2022,12,AA,American Airlines Inc.,OMA,"Omaha, NE: Eppley Airfield",226,77,25.15,4.52,16.5,0,30.83,2,0,5368,2478,349,604,0,
2022,12,AA,American Airlines Inc.,ONT,"Ontario, CA: Ontario International",250,87,29.27,7.7,19.11,0,30.92,1,0,6227,1953,975,590,0,
2022,12,AA,American Airlines Inc.,ORD,"Chicago, IL: Chicago O'Hare International",4148,765,228.33,21.61,161.22,2.07,351.77,98,5,68185,24099,2279,6911,132,
2022,12,AA,American Airlines Inc.,ORF,"Norfolk, VA: Norfolk International",208,61,14.08,0.82,5.5,0,40.6,0,1,4572,1041,75,238,0,
2022,12,AA,American Airlines Inc.,PBI,"West Palm Beach/Palm Beach, FL: Palm Beach International",449,139,41.53,6.84,38.1,0.11,52.42,2,1,9925,3167,324,1730,9,
2022,12,AA,American Airlines Inc.,PDX,"Portland, OR: Portland International",259,86,29,2.89,23.8,0,30.32,11,1,6374,2230,339,938,0,
2022,12,AA,American Airlines Inc.,PHL,"Philadelphia, PA: Philadelphia International",3018,647,217.02,22.32,106.11,1.22,300.32,32,3,65436,20998,1384,3906,88,
2022,12,AA,American Airlines Inc.,PHX,"Phoenix, AZ: Phoenix Sky Harbor International",4281,980,290.61,38.73,276.57,2.86,371.23,44,4,86000,33520,6176,10111,96,
2022,12,AA,American Airlines Inc.,PIT,"Pittsburgh, PA: Pittsburgh International",443,138,49.86,6.01,15,0,67.13,9,0,11044,3688,447,459,0,
2022,12,AA,American Airlines Inc.,PNS,"Pensacola, FL: Pensacola International",134,61,16.59,4.6,8.05,0,31.75,1,1,7885,1841,2129,492,0,
2022,12,AA,American Airlines Inc.,PSP,"Palm Springs, CA: Palm Springs International",173,57,13.77,4.15,19.61,0,19.46,1,1,4421,1714,253,707,0,
2022,12,AA,American Airlines Inc.,PVD,"Providence, RI: Rhode Island Tf Green International",166,37,12.36,0,8.27,0,16.36,3,0,3309,723,0,213,0,
2022,12,AA,American Airlines Inc.,PWM,"Portland, ME: Portland International Jetport",69,17,4.31,0,2.45,0,10.24,0,0,2139,291,0,83,0,
2022,12,AA,American Airlines Inc.,RDU,"Raleigh/Durham, NC: Raleigh-Durham International",810,214,76.34,6.75,25.31,0.06,105.54,8,1,16566,6700,430,1037,4,
2022,12,AA,American Airlines Inc.,RIC,"Richmond, VA: Richmond International",280,89,39.72,1.98,6.21,0,41.09,3,0,5681,2572,133,222,0,
2022,12,AA,American Airlines Inc.,RNO,"Reno, NV: Reno/Tahoe International",168,51,10.7,7.62,13.66,0,19.02,2,4,3384,359,1358,412,0,
2022,12,AA,American Airlines Inc.,ROC,"Rochester, NY: Frederick Douglass Grtr Rochester International",70,24,7.69,0,2.53,0,13.78,2,0,1675,547,0,91,0,
2022,12,AA,American Airlines Inc.,RSW,"Fort Myers, FL: Southwest Florida International",444,125,36.49,5.84,35.32,0.29,47.06,6,1,8066,1943,426,1420,7,
2022,12,AA,American Airlines Inc.,SAN,"San Diego, CA: San Diego International",669,246,85.6,11.95,82.61,1.27,64.57,19,13,12654,4381,739,2792,84,
2022,12,AA,American Airlines Inc.,SAT,"San Antonio, TX: San Antonio International",597,189,55.47,9.03,28.83,0.67,95.01,7,2,14854,3889,454,1003,12,
2022,12,AA,American Airlines Inc.,SAV,"Savannah, GA: Savannah/Hilton Head International",179,63,19.58,1.6,7.23,0,34.58,1,0,5011,1941,120,296,0,
2022,12,AA,American Airlines Inc.,SBA,"Santa Barbara, CA: Santa Barbara Municipal",107,53,26.47,2.06,4.64,0,19.82,1,0,5375,2966,147,295,0,
2022,12,AA,American Airlines Inc.,SBP,"San Luis Obispo, CA: San Luis County Regional",62,29,8.51,1.44,7.11,0,11.95,0,3,4286,1239,417,336,0,
2022,12,AA,American Airlines Inc.,SDF,"Louisville, KY: Louisville Muhammad Ali International",122,42,17.54,1,7.27,0,16.19,2,0,3183,1201,17,358,0,
2022,12,AA,American Airlines Inc.,SEA,"Seattle, WA: Seattle/Tacoma International",487,145,55.35,9.11,46.32,0.02,34.2,13,2,11480,5325,631,1749,1,
2022,12,AA,American Airlines Inc.,SFO,"San Francisco, CA: San Francisco International",755,291,80.67,8.64,114.31,0.4,86.99,6,1,18428,5377,736,4020,21,
2022,12,AA,American Airlines Inc.,SJC,"San Jose, CA: Norman Y. Mineta San Jose International",146,42,13.67,2.3,13.34,0.32,12.37,1,0,2755,1160,114,503,10,
2022,12,AA,American Airlines Inc.,SJU,"San Juan, PR: Luis Munoz Marin International",395,102,42.78,6.12,25.47,1.58,26.06,0,1,6258,2823,493,891,46,
