2020,12,G4,Allegiant Air,TVC,"Traverse City, MI: Cherry Capital",21,2,0.69,0,1.31,0,0,0,1,45,11,0,34,0,
2020,12,G4,Allegiant Air,TYS,"Knoxville, TN: McGhee Tyson",109,29,8.21,0.56,6,0,14.23,1,1,2039,688,17,361,0,
2020,12,G4,Allegiant Air,USA,"Concord, NC: Concord Padgett Regional",81,16,3.15,0,7.29,0,5.56,0,0,1055,71,0,751,0,
2020,12,G4,Allegiant Air,VPS,"Valparaiso, FL: Eglin AFB Destin Fort Walton Beach",62,9,2.19,0,3.31,0,3.51,3,0,494,131,0,62,0,
2020,12,G4,Allegiant Air,XNA,"Fayetteville, AR: Northwest Arkansas Regional",31,3,1,0,0.1,0,1.9,1,1,144,27,0,5,0,
2020,12,HA,Hawaiian Airlines Inc.,BOS,"Boston, MA: Logan International",4,1,1,0,0,0,0,0,0,18,18,0,0,0,
2020,12,HA,Hawaiian Airlines Inc.,HNL,"Honolulu, HI: Daniel K Inouye International",1398,82,56.63,2.26,0.42,0,22.68,19,1,6117,3849,1448,11,0,
2020,12,HA,Hawaiian Airlines Inc.,ITO,"Hilo, HI: Hilo International",235,11,8.97,0.13,0.96,0,0.94,3,1,241,186,2,27,0,
2020,12,HA,Hawaiian Airlines Inc.,JFK,"New York, NY: John F. Kennedy International",8,3,3,0,0,0,0,0,0,164,164,0,0,0,
2020,12,HA,Hawaiian Airlines Inc.,KOA,"Kona, HI: Ellison Onizuka Kona International at Keahole",279,18,12.48,1.41,0,0,4.11,6,0,472,314,35,0,0,
2020,12,HA,Hawaiian Airlines Inc.,LAS,"Las Vegas, NV: McCarran International",38,1,1,0,0,0,0,0,0,32,32,0,0,0,
2020,12,HA,Hawaiian Airlines Inc.,LAX,"Los Angeles, CA: Los Angeles International",82,15,14,0,0,0,1,0,0,582,547,0,0,0,
2020,12,HA,Hawaiian Airlines Inc.,LGB,"Long Beach, CA: Long Beach Airport",17,2,2,0,0,0,0,0,0,77,77,0,0,0,
2020,12,HA,Hawaiian Airlines Inc.,LIH,"Lihue, HI: Lihue Airport",181,5,4.24,0,0,0,0.76,21,0,91,78,0,0,0,
2020,12,HA,Hawaiian Airlines Inc.,OAK,"Oakland, CA: Metropolitan Oakland International",55,4,4,0,0,0,0,0,0,85,85,0,0,0,
2020,12,HA,Hawaiian Airlines Inc.,OGG,"Kahului, HI: Kahului Airport",547,24,21.91,0.54,0.16,0,1.38,7,1,921,868,19,5,0,
2020,12,HA,Hawaiian Airlines Inc.,PDX,"Portland, OR: Portland International",43,4,4,0,0,0,0,0,0,243,243,0,0,0,
2020,12,HA,Hawaiian Airlines Inc.,PHX,"Phoenix, AZ: Phoenix Sky Harbor International",22,2,2,0,0,0,0,0,1,144,144,0,0,0,
2020,12,HA,Hawaiian Airlines Inc.,SAN,"San Diego, CA: San Diego International",40,12,12,0,0,0,0,0,0,608,608,0,0,0,
2020,12,HA,Hawaiian Airlines Inc.,SEA,"Seattle, WA: Seattle/Tacoma International",54,9,9,0,0,0,0,0,0,274,274,0,0,0,
2020,12,HA,Hawaiian Airlines Inc.,SFO,"San Francisco, CA: San Francisco International",39,9,9,0,0,0,0,0,0,433,433,0,0,0,
2020,12,HA,Hawaiian Airlines Inc.,SJC,"San Jose, CA: Norman Y. Mineta San Jose International",46,3,3,0,0,0,0,0,0,64,64,0,0,0,
2020,12,HA,Hawaiian Airlines Inc.,SMF,"Sacramento, CA: Sacramento International",51,14,14,0,0,0,0,0,0,298,298,0,0,0,
2020,12,MQ,Envoy Air,ABE,"Allentown/Bethlehem/Easton, PA: Lehigh Valley International",25,0,0,0,0,0,0,1,0,0,0,0,0,0,
2020,12,MQ,Envoy Air,ABI,"Abilene, TX: Abilene Regional",133,10,3.8,0.06,2.72,0,3.41,4,0,803,236,2,330,0,
2020,12,MQ,Envoy Air,ABQ,"Albuquerque, NM: Albuquerque International Sunport",115,11,2.44,0.41,4.95,0,3.2,5,1,353,105,11,114,0,
2020,12,MQ,Envoy Air,ACT,"Waco, TX: Waco Regional",91,8,3.2,0.27,2.1,0,2.44,1,0,521,229,16,75,0,
2020,12,MQ,Envoy Air,AEX,"Alexandria, LA: Alexandria International",105,14,2.89,0,9.67,0,1.44,1,0,713,236,0,440,0,
2020,12,MQ,Envoy Air,AGS,"Augusta, GA: Augusta Regional at Bush Field",59,11,3.08,0.18,5.85,0,1.88,1,0,323,100,9,172,0,
2020,12,MQ,Envoy Air,ALO,"Waterloo, IA: Waterloo Regional",28,2,0.53,0,1.47,0,0,0,0,92,35,0,57,0,
2020,12,MQ,Envoy Air,AMA,"Amarillo, TX: Rick Husband Amarillo International",54,8,2.07,0.5,3.22,0,2.21,0,0,457,99,13,289,0,
2020,12,MQ,Envoy Air,ATW,"Appleton, WI: Appleton International",52,4,1,0.45,2.55,0,0,1,0,93,33,9,51,0,
2020,12,MQ,Envoy Air,AUS,"Austin, TX: Austin - Bergstrom International",12,2,0,0,2,0,0,0,0,61,0,0,61,0,
2020,12,MQ,Envoy Air,AVP,"Scranton/Wilkes-Barre, PA: Wilkes Barre Scranton International",28,5,0,0.86,2.92,0,1.23,1,0,155,0,42,78,0,
2020,12,MQ,Envoy Air,BDL,"Hartford, CT: Bradley International",15,4,0.22,0.56,0.93,0,2.29,0,0,303,15,58,26,0,
2020,12,MQ,Envoy Air,BHM,"Birmingham, AL: Birmingham-Shuttlesworth International",85,11,4.66,0,5.68,0,0.66,0,2,538,256,0,210,0,
2020,12,MQ,Envoy Air,BMI,"Bloomington/Normal, IL: Central Il Regional Airport at Bloomington",25,2,0.83,0.07,1.11,0,0,0,0,38,19,1,18,0,
2020,12,MQ,Envoy Air,BNA,"Nashville, TN: Nashville International",5,0,0,0,0,0,0,0,0,0,0,0,0,0,
2020,12,MQ,Envoy Air,BOI,"Boise, ID: Boise Air Terminal",30,3,1.47,0,1.53,0,0,0,0,63,29,0,34,0,
2020,12,MQ,Envoy Air,BPT,"Beaumont/Port Arthur, TX: Jack Brooks Regional",77,11,3.54,1,3.64,0,2.83,0,0,401,120,40,146,0,
2020,12,MQ,Envoy Air,BRO,"Brownsville, TX: Brownsville South Padre Island International",100,14,4.1,0.94,4.87,0,4.08,0,0,730,241,24,342,0,
2020,12,MQ,Envoy Air,BTR,"Baton Rouge, LA: Baton Rouge Metropolitan/Ryan Field",134,23,4.31,1.17,11.37,0,6.15,0,0,1000,158,40,519,0,
2020,12,MQ,Envoy Air,BUF,"Buffalo, NY: Buffalo Niagara International",33,10,5.37,0,3.63,1,0,2,0,329,235,0,79,15,
2020,12,MQ,Envoy Air,BWI,"Baltimore, MD: Baltimore/Washington International Thurgood Marshall",23,1,1,0,0,0,0,0,0,34,34,0,0,0,
2020,12,MQ,Envoy Air,BZN,"Bozeman, MT: Bozeman Yellowstone International",56,6,2.44,0,2.56,0,1,0,0,213,107,0,51,0,
2020,12,MQ,Envoy Air,CAE,"Columbia, SC: Columbia Metropolitan",59,9,3.15,0,1.99,0,3.86,0,0,420,103,0,90,0,
2020,12,MQ,Envoy Air,CHA,"Chattanooga, TN: Lovell Field",59,6,1.71,0.86,1.84,0,1.59,1,0,162,42,27,56,0,
2020,12,MQ,Envoy Air,CHS,"Charleston, SC: Charleston AFB/International",31,4,0.82,0,1.66,0,1.52,0,1,169,38,0,44,0,
2020,12,MQ,Envoy Air,CID,"Cedar Rapids/Iowa City, IA: The Eastern Iowa",79,10,2.67,0.53,6.23,0,0.56,1,0,314,75,8,188,0,
2020,12,MQ,Envoy Air,CLE,"Cleveland, OH: Cleveland-Hopkins International",55,11,1.44,0.08,6.86,0,2.63,0,0,884,140,12,264,0,
2020,12,MQ,Envoy Air,CLL,"College Station/Bryan, TX: Easterwood Field",80,12,0.3,1.08,6.56,0,4.06,0,0,1051,12,625,169,0,
2020,12,MQ,Envoy Air,CMH,"Columbus, OH: John Glenn Columbus International",132,17,7.77,0.69,6.25,0,2.28,0,1,1088,572,40,358,0,
2020,12,MQ,Envoy Air,CMI,"Champaign/Urbana, IL: University of Illinois/Willard",88,10,3.53,0.16,3.88,0,2.43,0,0,473,119,9,109,0,
2020,12,MQ,Envoy Air,COS,"Colorado Springs, CO: City of Colorado Springs Municipal",25,1,0,0,1,0,0,0,0,20,0,0,20,0,
2020,12,MQ,Envoy Air,COU,"Columbia, MO: Columbia Regional",59,5,0,0.08,3.5,0,1.42,0,0,392,0,10,172,0,
2020,12,MQ,Envoy Air,CRP,"Corpus Christi, TX: Corpus Christi International",174,23,4.06,0.88,8.26,0,9.8,2,0,791,203,29,227,0,
2020,12,MQ,Envoy Air,CVG,"Cincinnati, OH: Cincinnati/Northern Kentucky International",212,25,5.16,1.91,13.23,0,4.69,1,0,1169,150,46,493,0,
2020,12,MQ,Envoy Air,CWA,"Mosinee, WI: Central Wisconsin",28,2,0.86,0.43,0.57,0,0.14,1,0,92,61,9,12,0,
2020,12,MQ,Envoy Air,DAY,"Dayton, OH: James M Cox/Dayton International",86,12,3.47,0.65,6.41,0,1.47,0,0,475,132,34,248,0,
2020,12,MQ,Envoy Air,DCA,"Washington, DC: Ronald Reagan Washington National",14,1,0.01,0,0,0,0.99,0,0,169,2,0,0,0,
2020,12,MQ,Envoy Air,DFW,"Dallas/Fort Worth, TX: Dallas/Fort Worth International",6103,1229,172.87,43.91,761.79,6.28,244.16,75,10,62438,12254,4917,26876,208,
2020,12,MQ,Envoy Air,DSM,"Des Moines, IA: Des Moines International",83,5,2.91,0.9,0.2,0,1,1,0,242,97,103,14,0,
2020,12,MQ,Envoy Air,DTW,"Detroit, MI: Detroit Metro Wayne County",4,1,0,0,1,0,0,0,0,20,0,0,20,0,
2020,12,MQ,Envoy Air,ELP,"El Paso, TX: El Paso International",56,3,0.68,0.03,1.32,0,0.97,0,0,128,19,2,37,0,
2020,12,MQ,Envoy Air,EVV,"Evansville, IN: Evansville Regional",59,7,0.86,0.08,4.98,0,1.08,0,0,250,18,7,142,0,
2020,12,MQ,Envoy Air,EWR,"Newark, NJ: Newark Liberty International",14,2,0,0.05,0.41,0,1.53,0,0,215,0,2,16,0,
2020,12,MQ,Envoy Air,EYW,"Key West, FL: Key West International",24,4,1.9,1,1.1,0,0,0,0,194,59,110,25,0,
2020,12,MQ,Envoy Air,FAR,"Fargo, ND: Hector International",106,15,2.37,2.36,9.51,0,0.76,2,0,1186,66,829,275,0,
2020,12,MQ,Envoy Air,FNT,"Flint, MI: Bishop International",52,6,0.11,0.48,4.27,0,1.14,0,0,198,2,28,105,0,
2020,12,MQ,Envoy Air,FSD,"Sioux Falls, SD: Joe Foss Field",57,6,0.79,1.28,3.07,0,0.86,2,0,356,27,115,64,0,
2020,12,MQ,Envoy Air,FSM,"Fort Smith, AR: Fort Smith Regional",34,6,2.94,0,1.43,0,1.62,0,0,272,85,0,41,0,
2020,12,MQ,Envoy Air,GCK,"Garden City, KS: Garden City Regional",58,11,7,0,2,0,2,1,0,462,232,0,115,0,
2020,12,MQ,Envoy Air,GGG,"Longview, TX: East Texas Regional",71,10,3.08,0.08,4.63,0,2.22,1,1,278,59,7,100,0,
2020,12,MQ,Envoy Air,GJT,"Grand Junction, CO: Grand Junction Regional",59,6,0.95,0,3.1,0,1.95,0,0,356,61,0,99,0,
2020,12,MQ,Envoy Air,GNV,"Gainesville, FL: Gainesville Regional",26,1,0.43,0,0.57,0,0,1,0,23,10,0,13,0,
2020,12,MQ,Envoy Air,GPT,"Gulfport/Biloxi, MS: Gulfport-Biloxi International",71,7,2.6,0,2.02,0,2.38,0,0,308,96,0,88,0,
2020,12,MQ,Envoy Air,GRB,"Green Bay, WI: Green Bay Austin Straubel International",66,2,1,0.3,0.7,0,0,1,0,53,16,11,26,0,
2020,12,MQ,Envoy Air,GRI,"Grand Island, NE: Central Nebraska Regional",59,5,1.23,1,1.35,0,1.42,1,0,316,27,118,31,0,
2020,12,MQ,Envoy Air,GRK,"Killeen, TX: Robert Gray AAF",176,25,5.85,3.99,10.76,0,4.41,2,0,1207,327,210,443,0,
2020,12,MQ,Envoy Air,GRR,"Grand Rapids, MI: Gerald R. Ford International",105,18,5.18,0.24,6.61,0.44,5.53,0,0,1126,231,9,282,19,
2020,12,MQ,Envoy Air,GSO,"Greensboro/High Point, NC: Piedmont Triad International",88,14,6.01,1.58,3.5,0,2.91,0,1,588,214,45,105,0,
2020,12,MQ,Envoy Air,GSP,"Greer, SC: Greenville-Spartanburg International",51,6,2.43,0,3.43,0,0.14,0,0,217,120,0,93,0,
2020,12,MQ,Envoy Air,HDN,"Hayden, CO: Yampa Valley",13,2,1,0,1,0,0,0,0,67,27,0,40,0,
2020,12,MQ,Envoy Air,HOU,"Houston, TX: William P Hobby",30,6,0.61,0,4.01,0,1.39,0,0,371,50,0,193,0,
2020,12,MQ,Envoy Air,HRL,"Harlingen/San Benito, TX: Valley International",6,0,0,0,0,0,0,0,0,0,0,0,0,0,
2020,12,MQ,Envoy Air,HSV,"Huntsville, AL: Huntsville International-Carl T Jones Field",129,17,5.59,0.21,7.24,0,3.95,1,0,836,252,15,448,0,
2020,12,MQ,Envoy Air,IAH,"Houston, TX: George Bush Intercontinental/Houston",33,4,0,0.13,2.87,0,1,0,0,238,0,10,147,0,
2020,12,MQ,Envoy Air,ICT,"Wichita, KS: Wichita Dwight D Eisenhower National",100,13,5.35,0.91,2.2,0,4.55,0,0,590,175,86,71,0,
2020,12,MQ,Envoy Air,ILM,"Wilmington, NC: Wilmington International",60,13,3.79,0.7,6.14,0,2.38,0,0,483,132,18,231,0,
2020,12,MQ,Envoy Air,IND,"Indianapolis, IN: Indianapolis International",41,8,2.6,0.53,1.74,0,3.13,0,0,341,170,10,59,0,
2020,12,MQ,Envoy Air,JAN,"Jackson/Vicksburg, MS: Jackson Medgar Wiley Evers International",144,10,1.26,0.2,2.24,1,5.31,2,0,395,38,11,58,73,
2020,12,MQ,Envoy Air,JAX,"Jacksonville, FL: Jacksonville International",16,2,0,0,0.22,0,1.78,0,0,167,0,0,17,0,
2020,12,MQ,Envoy Air,JLN,"Joplin, MO: Joplin Regional",16,1,0,0.37,0.63,0,0,0,0,52,0,19,33,0,
2020,12,MQ,Envoy Air,LAN,"Lansing, MI: Capital Region International",28,3,1,0.03,1.15,0,0.82,0,0,243,20,6,47,0,
2020,12,MQ,Envoy Air,LAW,"Lawton/Fort Sill, OK: Lawton-Fort Sill Regional",68,12,1,1.78,7.02,0,2.2,15,1,2365,46,837,203,0,
2020,12,MQ,Envoy Air,LBB,"Lubbock, TX: Lubbock Preston Smith International",30,5,1,0,1.82,0,2.18,0,0,189,66,0,50,0,
2020,12,MQ,Envoy Air,LEX,"Lexington, KY: Blue Grass",100,9,2.95,0.82,4.36,0,0.87,0,1,502,108,68,275,0,
2020,12,MQ,Envoy Air,LFT,"Lafayette, LA: Lafayette Regional Paul Fournet Field",24,1,0,0,1,0,0,0,0,173,0,0,173,0,
2020,12,MQ,Envoy Air,LIT,"Little Rock, AR: Bill and Hillary Clinton Nat Adams Field",205,32,5.93,0.8,15.79,0,9.49,1,0,2182,925,25,800,0,
2020,12,MQ,Envoy Air,LRD,"Laredo, TX: Laredo International",78,8,1.98,0.34,4.1,0,1.58,0,0,672,307,11,227,0,
2020,12,MQ,Envoy Air,LSE,"La Crosse, WI: La Crosse Regional",55,5,2,0.18,2.7,0,0.13,0,0,243,156,10,75,0,
2020,12,MQ,Envoy Air,MCI,"Kansas City, MO: Kansas City International",232,28,7.25,0.09,13.95,1,5.7,1,0,1071,309,3,457,16,
2020,12,MQ,Envoy Air,MDT,"Harrisburg, PA: Harrisburg International",59,6,1.26,0,2.77,0,1.96,2,0,357,80,0,60,0,
2020,12,MQ,Envoy Air,MEM,"Memphis, TN: Memphis International",129,20,4.6,2.35,12.36,0,0.69,1,0,715,102,92,488,0,
2020,12,MQ,Envoy Air,MFE,"Mission/McAllen/Edinburg, TX: McAllen Miller International",107,22,7.72,0.7,7.84,0,5.73,0,0,935,396,28,335,0,
2020,12,MQ,Envoy Air,MGM,"Montgomery, AL: Montgomery Regional",59,8,3.25,0.2,2.09,0,2.46,0,0,573,155,11,112,0,
2020,12,MQ,Envoy Air,MHK,"Manhattan/Ft. Riley, KS: Manhattan Regional",58,4,0.62,0,1.52,0,1.86,0,0,155,18,0,27,0,
2020,12,MQ,Envoy Air,MIA,"Miami, FL: Miami International",246,25,9.05,1.48,11.56,0,2.91,1,0,1216,746,63,307,0,
2020,12,MQ,Envoy Air,MKE,"Milwaukee, WI: General Mitchell International",24,1,1,0,0,0,0,0,0,34,34,0,0,0,
2020,12,MQ,Envoy Air,MLI,"Moline, IL: Quad City International",25,5,0.06,0.38,3.74,0,0.83,1,0,261,1,29,145,0,
2020,12,MQ,Envoy Air,MLU,"Monroe, LA: Monroe Regional",83,13,6.38,0.51,3.79,0,2.32,0,0,670,358,17,162,0,
2020,12,MQ,Envoy Air,MOB,"Mobile, AL: Mobile Regional",80,11,2.92,0,6.56,0,1.52,0,1,628,172,0,312,0,
2020,12,MQ,Envoy Air,MQT,"Marquette, MI: Sawyer International",41,4,1.63,0.07,2.15,0,0.15,0,1,137,33,5,88,0,
2020,12,MQ,Envoy Air,MRY,"Monterey, CA: Monterey Regional",30,9,0.8,0.05,8.16,0,0,0,0,234,24,1,209,0,
2020,12,MQ,Envoy Air,MSN,"Madison, WI: Dane County Regional-Truax Field",52,9,1.29,0.25,6.08,0,1.38,0,0,381,105,17,190,0,
2020,12,MQ,Envoy Air,MSO,"Missoula, MT: Missoula International",60,13,4.8,0.09,4.09,0,4.02,0,0,485,153,5,156,0,
2020,12,MQ,Envoy Air,MSP,"Minneapolis, MN: Minneapolis-St Paul International",97,14,5.84,2.34,3.47,0,2.35,3,0,531,278,65,95,0,
2020,12,MQ,Envoy Air,MSY,"New Orleans, LA: Louis Armstrong New Orleans International",106,13,2.13,0.17,7.86,0,2.84,1,0,790,122,5,334,0,
2020,12,MQ,Envoy Air,MYR,"Myrtle Beach, SC: Myrtle Beach International",31,10,1.11,0,6.49,0,2.4,0,0,376,70,0,203,0,
2020,12,MQ,Envoy Air,OKC,"Oklahoma City, OK: Will Rogers World",70,6,3.53,0,1.41,0,1.06,1,0,376,238,0,63,0,
2020,12,MQ,Envoy Air,OMA,"Omaha, NE: Eppley Airfield",119,14,3.81,0,6.18,0,4.01,2,0,681,276,0,238,0,
2020,12,MQ,Envoy Air,ORD,"Chicago, IL: Chicago O'Hare International",2051,224,46.49,23.55,98.99,0.04,54.93,19,1,18798,5201,4310,3843,2,
2020,12,MQ,Envoy Air,ORF,"Norfolk, VA: Norfolk International",81,6,1.49,0,3.16,0,1.35,0,1,298,103,0,97,0,
2020,12,MQ,Envoy Air,PBI,"West Palm Beach/Palm Beach, FL: Palm Beach International",14,4,0.67,0,2,0,1.33,0,0,419,102,0,60,0,
2020,12,MQ,Envoy Air,PHX,"Phoenix, AZ: Phoenix Sky Harbor International",12,4,0.06,0.24,1.95,0,1.75,0,0,178,1,27,36,0,
2020,12,MQ,Envoy Air,PIA,"Peoria, IL: General Downing - Peoria International",27,2,1.95,0,0.05,0,0,0,0,101,97,0,4,0,
2020,12,MQ,Envoy Air,PIT,"Pittsburgh, PA: Pittsburgh International",31,2,0.99,0.07,0.28,0,0.65,0,0,289,178,8,31,0,
2020,12,MQ,Envoy Air,PNS,"Pensacola, FL: Pensacola International",85,4,1,0.3,2.7,0,0,1,0,71,16,6,49,0,
2020,12,MQ,Envoy Air,PVD,"Providence, RI: Theodore Francis Green State",28,4,1,1.27,1.56,0,0.17,1,0,198,17,52,121,0,
2020,12,MQ,Envoy Air,PWM,"Portland, ME: Portland International Jetport",24,4,1.23,0.65,2.08,0,0.04,1,0,104,21,30,52,0,
2020,12,MQ,Envoy Air,RDU,"Raleigh/Durham, NC: Raleigh-Durham International",49,8,4.58,0,3,0,0.42,0,0,368,135,0,201,0,
2020,12,MQ,Envoy Air,ROC,"Rochester, NY: Greater Rochester International",12,0,0,0,0,0,0,0,0,0,0,0,0,0,
2020,12,MQ,Envoy Air,RST,"Rochester, MN: Rochester International",28,4,1,1,2,0,0,0,0,134,16,30,88,0,
2020,12,MQ,Envoy Air,RSW,"Fort Myers, FL: Southwest Florida International",14,0,0,0,0,0,0,0,0,0,0,0,0,0,
2020,12,MQ,Envoy Air,SAV,"Savannah, GA: Savannah/Hilton Head International",59,8,1.46,0.1,3.88,0,2.56,0,1,369,70,6,129,0,
2020,12,MQ,Envoy Air,SBA,"Santa Barbara, CA: Santa Barbara Municipal",60,8,2.04,0.85,3.08,0,2.04,0,1,363,62,22,160,0,
2020,12,MQ,Envoy Air,SBP,"San Luis Obispo, CA: San Luis County Regional",43,2,0.33,0,1,0,0.67,0,1,67,6,0,49,0,
2020,12,MQ,Envoy Air,SDF,"Louisville, KY: Louisville Muhammad Ali International",25,3,0.05,0,1.75,0,1.19,0,0,92,2,0,48,0,
2020,12,MQ,Envoy Air,SGF,"Springfield, MO: Springfield-Branson National",216,26,11.14,0.54,7.99,0,6.32,1,0,1552,463,34,615,0,
2020,12,MQ,Envoy Air,SHV,"Shreveport, LA: Shreveport Regional",52,6,3.21,0,1.05,0,1.74,1,0,396,217,0,40,0,
2020,12,MQ,Envoy Air,SJT,"San Angelo, TX: San Angelo Regional/Mathis Field",124,9,2.46,0.22,3.73,0.96,1.63,3,0,497,65,15,311,27,
2020,12,MQ,Envoy Air,SPS,"Wichita Falls, TX: Sheppard AFB/Wichita Falls Municipal",84,14,2.53,1.27,8.61,0,1.58,1,0,445,158,30,186,0,
2020,12,MQ,Envoy Air,SRQ,"Sarasota/Bradenton, FL: Sarasota/Bradenton International",104,17,4,0.97,11.24,0,0.79,0,0,578,111,93,344,0,
2020,12,MQ,Envoy Air,STL,"St. Louis, MO: St Louis Lambert International",111,10,2.33,1,4.43,0,2.24,1,0,479,162,105,126,0,
2020,12,MQ,Envoy Air,STS,"Santa Rosa, CA: Charles M. Schulz - Sonoma County",1,0,0,0,0,0,0,0,0,0,0,0,0,0,
2020,12,MQ,Envoy Air,SUX,"Sioux City, IA: Sioux Gateway Brig Gen Bud Day Field",28,1,0,0,1,0,0,1,0,17,0,0,17,0,
2020,12,MQ,Envoy Air,SWO,"Stillwater, OK: Stillwater Regional",41,4,1,0.08,2,0,0.92,0,0,171,38,7,45,0,
2020,12,MQ,Envoy Air,TOL,"Toledo, OH: Toledo Express",1,0,0,0,0,0,0,0,0,0,0,0,0,0,
2020,12,MQ,Envoy Air,TUL,"Tulsa, OK: Tulsa International",39,5,2.15,0,1.75,0,1.1,0,0,238,143,0,72,0,
2020,12,MQ,Envoy Air,TVC,"Traverse City, MI: Cherry Capital",80,15,7.68,0.57,6.17,0,0.59,3,0,581,404,13,144,0,
2020,12,MQ,Envoy Air,TXK,"Texarkana, AR: Texarkana Regional-Webb Field",83,10,2.75,1,3.54,0,2.72,0,0,1001,266,45,245,0,
2020,12,MQ,Envoy Air,TYR,"Tyler, TX: Tyler Pounds Regional",105,13,0.15,0.32,9.05,0,3.48,3,1,541,6,56,252,0,
2020,12,MQ,Envoy Air,TYS,"Knoxville, TN: McGhee Tyson",19,1,0,0,1,0,0,1,1,32,0,0,32,0,
2020,12,MQ,Envoy Air,VPS,"Valparaiso, FL: Eglin AFB Destin Fort Walton Beach",89,10,0.21,1.08,4.84,0,3.87,0,1,371,5,42,223,0,
2020,12,MQ,Envoy Air,XNA,"Fayetteville, AR: Northwest Arkansas Regional",222,31,10.48,0.88,9.53,0,10.12,3,1,1721,350,35,1054,0,
2020,12,NK,Spirit Air Lines,ACY,"Atlantic City, NJ: Atlantic City International",169,9,1.06,0.89,2.86,0,4.2,5,3,1053,53,31,426,0,
2020,12,NK,Spirit Air Lines,ATL,"Atlanta, GA: Hartsfield-Jackson Atlanta International",624,96,22.07,1.8,56.2,0.24,15.69,5,0,5400,996,66,3146,4,
2020,12,NK,Spirit Air Lines,AUS,"Austin, TX: Austin - Bergstrom International",127,17,4.95,0.45,10.3,0,1.3,1,0,538,204,9,271,0,
2020,12,NK,Spirit Air Lines,BDL,"Hartford, CT: Bradley International",70,15,4.27,0,6.88,0.62,3.24,0,0,1197,252,0,697,32,
2020,12,NK,Spirit Air Lines,BNA,"Nashville, TN: Nashville International",106,9,2.17,0.68,5.23,0,0.91,0,0,644,76,88,437,0,
2020,12,NK,Spirit Air Lines,BOS,"Boston, MA: Logan International",250,35,7.14,1,22.59,0,4.28,8,0,1887,455,20,1223,0,
2020,12,NK,Spirit Air Lines,BUR,"Burbank, CA: Bob Hope",25,1,0,0,0,0,1,1,0,43,0,0,0,0,
2020,12,NK,Spirit Air Lines,BWI,"Baltimore, MD: Baltimore/Washington International Thurgood Marshall",357,49,15,0,28.42,0,5.57,14,0,2135,990,0,962,0,
2020,12,NK,Spirit Air Lines,CAK,"Akron, OH: Akron-Canton Regional",42,4,1,0,1.19,0,1.81,1,0,239,74,0,46,0,
2020,12,NK,Spirit Air Lines,CLE,"Cleveland, OH: Cleveland-Hopkins International",211,32,4.34,0,19.92,1,6.74,3,0,1444,319,0,782,15,
2020,12,NK,Spirit Air Lines,CLT,"Charlotte, NC: Charlotte Douglas International",49,9,4.15,0,2.17,0,2.67,0,0,450,185,0,132,0,
2020,12,NK,Spirit Air Lines,CMH,"Columbus, OH: John Glenn Columbus International",125,13,4.58,0,5.14,0,3.28,1,0,430,185,0,151,0,
2020,12,NK,Spirit Air Lines,DEN,"Denver, CO: Denver International",153,32,7.11,0,17.03,0,7.87,0,0,1157,320,0,577,0,
2020,12,NK,Spirit Air Lines,DFW,"Dallas/Fort Worth, TX: Dallas/Fort Worth International",451,64,15.99,0.68,32.35,0.17,14.81,3,2,3500,965,33,1709,9,
2020,12,NK,Spirit Air Lines,DTW,"Detroit, MI: Detroit Metro Wayne County",625,113,26.67,0.47,67.63,1,17.24,6,0,7778,1951,21,4103,22,
2020,12,NK,Spirit Air Lines,EWR,"Newark, NJ: Newark Liberty International",565,72,19.73,1.79,34.38,2.1,14,8,4,4158,1053,136,1616,34,
2020,12,NK,Spirit Air Lines,FLL,"Fort Lauderdale, FL: Fort Lauderdale-Hollywood International",1592,237,51.29,4.93,118.73,5.78,56.27,15,4,14817,3327,317,6402,191,
2020,12,NK,Spirit Air Lines,IAH,"Houston, TX: George Bush Intercontinental/Houston",430,79,22.85,0.97,38.92,1.14,15.12,3,0,3493,854,38,1513,41,
2020,12,NK,Spirit Air Lines,IND,"Indianapolis, IN: Indianapolis International",100,10,2.22,0.85,4.95,0.37,1.62,1,0,324,82,18,153,7,
2020,12,NK,Spirit Air Lines,LAS,"Las Vegas, NV: McCarran International",1070,120,29.95,3.58,62.63,1.74,22.1,7,0,7415,1525,1623,2811,49,
2020,12,NK,Spirit Air Lines,LAX,"Los Angeles, CA: Los Angeles International",552,108,26.47,0.88,59.95,1.15,19.54,8,0,4974,1598,45,2162,26,
2020,12,NK,Spirit Air Lines,LBE,"Latrobe, PA: Arnold Palmer Regional",64,11,2.05,0,6.16,0.17,2.61,0,0,725,292,0,283,4,
2020,12,NK,Spirit Air Lines,LGA,"New York, NY: LaGuardia",238,45,11.82,0,27.39,1,4.79,6,1,2020,537,0,816,47,
2020,12,NK,Spirit Air Lines,MCI,"Kansas City, MO: Kansas City International",76,6,0.53,0,4.67,0,0.8,1,0,269,9,0,214,0,
2020,12,NK,Spirit Air Lines,MCO,"Orlando, FL: Orlando International",1310,207,47.76,3.3,112.21,4.69,39.04,10,3,9386,2403,227,4503,134,
2020,12,NK,Spirit Air Lines,MSP,"Minneapolis, MN: Minneapolis-St Paul International",108,19,4.18,0.73,11.31,0,2.77,1,0,1157,467,22,520,0,
2020,12,NK,Spirit Air Lines,MSY,"New Orleans, LA: Louis Armstrong New Orleans International",248,27,6.09,0.1,12.72,1.92,6.17,1,0,1537,409,15,566,62,
2020,12,NK,Spirit Air Lines,MYR,"Myrtle Beach, SC: Myrtle Beach International",144,19,3.81,0.89,8.25,0.82,5.23,6,0,1333,118,34,474,18,
2020,12,NK,Spirit Air Lines,OAK,"Oakland, CA: Metropolitan Oakland International",111,7,2.23,0,1.12,0,3.65,0,0,529,177,0,177,0,
2020,12,NK,Spirit Air Lines,ORD,"Chicago, IL: Chicago O'Hare International",501,92,9.28,4.43,68.72,0.78,8.79,2,0,5119,410,395,3695,18,
2020,12,NK,Spirit Air Lines,PBI,"West Palm Beach/Palm Beach, FL: Palm Beach International",61,7,1.66,0,4.45,0,0.89,2,1,319,87,0,191,0,
2020,12,NK,Spirit Air Lines,PDX,"Portland, OR: Portland International",50,7,2.01,0,3.5,0,1.49,0,0,540,65,0,434,0,
2020,12,NK,Spirit Air Lines,PHL,"Philadelphia, PA: Philadelphia International",263,46,12.25,0,22.61,2.58,8.56,1,1,1943,453,0,947,55,
2020,12,NK,Spirit Air Lines,PHX,"Phoenix, AZ: Phoenix Sky Harbor International",67,12,3.21,0,8.01,0,0.77,0,0,655,132,0,499,0,
2020,12,NK,Spirit Air Lines,PIT,"Pittsburgh, PA: Pittsburgh International",190,17,6.91,0,9.31,0,0.79,0,0,549,241,0,286,0,
2020,12,NK,Spirit Air Lines,RDU,"Raleigh/Durham, NC: Raleigh-Durham International",50,9,1.85,0,2.04,0.22,4.89,0,0,450,49,0,59,4,
2020,12,NK,Spirit Air Lines,RIC,"Richmond, VA: Richmond International",29,2,0.76,0,1.24,0,0,0,0,42,17,0,25,0,
2020,12,NK,Spirit Air Lines,RSW,"Fort Myers, FL: Southwest Florida International",326,57,10.93,0.24,38.98,0.26,6.59,4,0,2698,781,7,1352,7,
2020,12,NK,Spirit Air Lines,SAN,"San Diego, CA: San Diego International",69,10,4.51,0,4.62,0,0.87,0,0,214,95,0,106,0,
2020,12,NK,Spirit Air Lines,SEA,"Seattle, WA: Seattle/Tacoma International",43,10,0.37,0,8,0.7,0.93,0,0,256,10,0,199,19,
2020,12,NK,Spirit Air Lines,SJU,"San Juan, PR: Luis Munoz Marin International",364,43,7.15,4.42,21.91,0,9.52,4,1,1974,273,220,955,0,
2020,12,NK,Spirit Air Lines,SMF,"Sacramento, CA: Sacramento International",41,4,1,0,0.09,0,2.91,0,0,117,24,0,2,0,
2020,12,NK,Spirit Air Lines,SNA,"Santa Ana, CA: John Wayne Airport-Orange County",68,5,1.71,0,0.77,0,2.52,0,0,348,201,0,20,0,
2020,12,NK,Spirit Air Lines,STT,"Charlotte Amalie, VI: Cyril E King",45,2,0,0,1.51,0,0.49,0,0,85,0,0,55,0,
2020,12,NK,Spirit Air Lines,STX,"Christiansted, VI: Henry E. Rohlsen",24,4,3.34,0,0.66,0,0,0,0,180,129,0,51,0,
2020,12,NK,Spirit Air Lines,TPA,"Tampa, FL: Tampa International",562,104,22.95,3.59,58.5,0.91,18.05,8,1,4550,907,287,2233,26,
2020,12,OH,PSA Airlines Inc.,ABE,"Allentown/Bethlehem/Easton, PA: Lehigh Valley International",80,10,1.9,0,7.02,0,1.08,3,1,298,74,0,156,0,
2020,12,OH,PSA Airlines Inc.,AGS,"Augusta, GA: Augusta Regional at Bush Field",52,7,3.82,1,1.32,0,0.85,0,0,413,148,96,34,0,
2020,12,OH,PSA Airlines Inc.,ALB,"Albany, NY: Albany International",12,0,0,0,0,0,0,0,0,0,0,0,0,0,
2020,12,OH,PSA Airlines Inc.,ATL,"Atlanta, GA: Hartsfield-Jackson Atlanta International",60,8,5.74,0.53,0.59,0.94,0.2,0,0,244,183,10,13,31,
2020,12,OH,PSA Airlines Inc.,AVL,"Asheville, NC: Asheville Regional",131,18,4.38,0.56,10.31,0,2.74,0,0,575,173,27,210,0,
2020,12,OH,PSA Airlines Inc.,AVP,"Scranton/Wilkes-Barre, PA: Wilkes Barre Scranton International",83,7,4.44,0,2.56,0,0,2,0,253,189,0,64,0,
2020,12,OH,PSA Airlines Inc.,BDL,"Hartford, CT: Bradley International",97,9,3.13,0.54,3.87,0,1.46,1,0,324,96,21,137,0,
2020,12,OH,PSA Airlines Inc.,BGR,"Bangor, ME: Bangor International",79,6,3.94,2,0.06,0,0,1,0,157,87,69,1,0,
2020,12,OH,PSA Airlines Inc.,BHM,"Birmingham, AL: Birmingham-Shuttlesworth International",154,22,1.71,0,14.07,0.65,5.57,0,0,836,89,0,426,36,
2020,12,OH,PSA Airlines Inc.,BNA,"Nashville, TN: Nashville International",64,7,5.83,0,1.09,0,0.08,0,0,797,715,0,78,0,
2020,12,OH,PSA Airlines Inc.,BTR,"Baton Rouge, LA: Baton Rouge Metropolitan/Ryan Field",61,11,2.36,0,8.64,0,0,0,0,254,55,0,199,0,
2020,12,OH,PSA Airlines Inc.,BTV,"Burlington, VT: Burlington International",129,7,2.26,1.53,1.74,0,1.47,0,0,365,185,88,45,0,
2020,12,OH,PSA Airlines Inc.,BUF,"Buffalo, NY: Buffalo Niagara International",18,1,0,0,0,0,1,1,0,44,0,0,0,0,
2020,12,OH,PSA Airlines Inc.,CAE,"Columbia, SC: Columbia Metropolitan",92,5,3.73,1,0.27,0,0,0,0,148,100,36,12,0,
2020,12,OH,PSA Airlines Inc.,CAK,"Akron, OH: Akron-Canton Regional",97,6,3.04,0,2.96,0,0,0,0,174,108,0,66,0,
2020,12,OH,PSA Airlines Inc.,CHA,"Chattanooga, TN: Lovell Field",62,4,1.08,0,1.55,0.53,0.83,0,0,213,102,0,27,16,
2020,12,OH,PSA Airlines Inc.,CHO,"Charlottesville, VA: Charlottesville Albemarle",32,2,0,1,0,0,1,0,0,93,0,21,0,0,
2020,12,OH,PSA Airlines Inc.,CHS,"Charleston, SC: Charleston AFB/International",256,33,9.43,1,17.71,0.85,4.02,0,0,1003,361,80,425,28,
