2021,11,OO,SkyWest Airlines Inc.,HRL,"Harlingen/San Benito, TX: Valley International",56,6,2,0,0,0,4,1,1,308,65,0,0,0,
2021,11,OO,SkyWest Airlines Inc.,HSV,"Huntsville, AL: Huntsville International-Carl T Jones Field",96,13,9,0,0,0,4,0,0,669,379,0,0,0,
2021,11,OO,SkyWest Airlines Inc.,HYS,"Hays, KS: Hays Regional",51,6,5,0,0,0,1,0,0,370,346,0,0,0,
2021,11,OO,SkyWest Airlines Inc.,IAD,"Washington, DC: Washington Dulles International",433,84,67,6,0,1,10,5,0,8377,5648,975,0,21,
2021,11,OO,SkyWest Airlines Inc.,IAH,"Houston, TX: George Bush Intercontinental/Houston",1888,232,185,15,8,1,23,1,2,23412,17983,1739,1215,26,
2021,11,OO,SkyWest Airlines Inc.,ICT,"Wichita, KS: Wichita Dwight D Eisenhower National",285,32,20,1,0,0,11,1,0,1410,767,24,0,0,
2021,11,OO,SkyWest Airlines Inc.,IDA,"Idaho Falls, ID: Idaho Falls Regional",315,36,27,4,0,0,5,0,1,4340,3753,364,0,0,
2021,11,OO,SkyWest Airlines Inc.,IMT,"Iron Mountain/Kingsfd, MI: Ford",60,9,6,3,0,0,0,0,0,330,209,121,0,0,
2021,11,OO,SkyWest Airlines Inc.,IND,"Indianapolis, IN: Indianapolis International",128,22,14,2,0,0,6,2,0,1540,704,101,0,0,
2021,11,OO,SkyWest Airlines Inc.,INL,"International Falls, MN: Falls International Einarson Field",50,8,5,3,0,0,0,0,0,1329,308,1021,0,0,
2021,11,OO,SkyWest Airlines Inc.,JAC,"Jackson, WY: Jackson Hole",36,1,1,0,0,0,0,0,0,20,20,0,0,0,
2021,11,OO,SkyWest Airlines Inc.,JAN,"Jackson/Vicksburg, MS: Jackson Medgar Wiley Evers International",93,12,5,2,0,0,5,1,0,647,177,77,0,0,
2021,11,OO,SkyWest Airlines Inc.,JAX,"Jacksonville, FL: Jacksonville International",56,5,5,0,0,0,0,0,0,136,136,0,0,0,
2021,11,OO,SkyWest Airlines Inc.,JLN,"Joplin, MO: Joplin Regional",65,5,3,0,0,0,2,0,0,395,252,0,0,0,
2021,11,OO,SkyWest Airlines Inc.,JMS,"Jamestown, ND: Jamestown Regional",88,5,5,0,0,0,0,4,2,117,117,0,0,0,
2021,11,OO,SkyWest Airlines Inc.,JST,"Johnstown, PA: John Murtha Johnstown-Cambria County",58,7,5,0,0,0,2,1,0,1920,1737,0,0,0,
2021,11,OO,SkyWest Airlines Inc.,LAN,"Lansing, MI: Capital Region International",30,3,3,0,0,0,0,0,0,145,145,0,0,0,
2021,11,OO,SkyWest Airlines Inc.,LAR,"Laramie, WY: Laramie Regional",51,3,3,0,0,0,0,0,1,707,707,0,0,0,
2021,11,OO,SkyWest Airlines Inc.,LAS,"Las Vegas, NV: McCarran International",207,36,20,8,4,0,4,0,0,3018,2063,542,305,0,
2021,11,OO,SkyWest Airlines Inc.,LAW,"Lawton/Fort Sill, OK: Lawton-Fort Sill Regional",2,1,0,0,0,0,1,0,0,106,0,0,0,0,
2021,11,OO,SkyWest Airlines Inc.,LAX,"Los Angeles, CA: Los Angeles International",4124,552,351,61,10,2,128,25,5,45732,28626,5449,691,279,
2021,11,OO,SkyWest Airlines Inc.,LBB,"Lubbock, TX: Lubbock Preston Smith International",64,7,7,0,0,0,0,0,0,1089,1089,0,0,0,
2021,11,OO,SkyWest Airlines Inc.,LBF,"North Platte, NE: North Platte Regional Airport Lee Bird Field",51,5,5,0,0,0,0,0,1,191,191,0,0,0,
2021,11,OO,SkyWest Airlines Inc.,LBL,"Liberal, KS: Liberal Mid-America Regional",51,1,1,0,0,0,0,0,0,87,87,0,0,0,
2021,11,OO,SkyWest Airlines Inc.,LCH,"Lake Charles, LA: Lake Charles Regional",26,5,3,0,0,0,2,0,0,954,771,0,0,0,
2021,11,OO,SkyWest Airlines Inc.,LEX,"Lexington, KY: Blue Grass",12,0,0,0,0,0,0,0,0,0,0,0,0,0,
2021,11,OO,SkyWest Airlines Inc.,LFT,"Lafayette, LA: Lafayette Regional Paul Fournet Field",56,5,1,1,0,0,3,0,0,251,20,108,0,0,
2021,11,OO,SkyWest Airlines Inc.,LGA,"New York, NY: LaGuardia",195,29,22,0,3,0,4,3,0,1249,855,0,194,0,
2021,11,OO,SkyWest Airlines Inc.,LGB,"Long Beach, CA: Long Beach Airport",119,11,11,0,0,0,0,0,1,611,611,0,0,0,
2021,11,OO,SkyWest Airlines Inc.,LIT,"Little Rock, AR: Bill and Hillary Clinton Nat Adams Field",36,8,7,0,0,0,1,0,1,317,262,0,0,0,
2021,11,OO,SkyWest Airlines Inc.,LNK,"Lincoln, NE: Lincoln Airport",62,7,6,1,0,0,0,1,1,494,468,26,0,0,
2021,11,OO,SkyWest Airlines Inc.,LRD,"Laredo, TX: Laredo International",3,2,0,0,0,0,2,0,0,275,0,0,0,0,
2021,11,OO,SkyWest Airlines Inc.,LSE,"La Crosse, WI: La Crosse Regional",90,8,6,1,0,1,0,0,0,657,311,326,0,20,
2021,11,OO,SkyWest Airlines Inc.,LWB,"Lewisburg, WV: Greenbrier Valley",51,4,2,0,0,0,2,0,0,557,218,0,0,0,
2021,11,OO,SkyWest Airlines Inc.,LWS,"Lewiston, ID: Lewiston Nez Perce County",91,1,1,0,0,0,0,1,2,21,21,0,0,0,
2021,11,OO,SkyWest Airlines Inc.,MAF,"Midland/Odessa, TX: Midland International Air and Space Port",209,24,20,1,0,0,3,0,1,1747,847,37,0,0,
2021,11,OO,SkyWest Airlines Inc.,MBS,"Saginaw/Bay City/Midland, MI: MBS International",29,0,0,0,0,0,0,0,0,0,0,0,0,0,
2021,11,OO,SkyWest Airlines Inc.,MCI,"Kansas City, MO: Kansas City International",268,26,18,2,0,0,6,0,0,1332,785,71,0,0,
2021,11,OO,SkyWest Airlines Inc.,MCW,"Mason City, IA: Mason City Municipal",51,5,4,0,0,0,1,0,2,931,876,0,0,0,
2021,11,OO,SkyWest Airlines Inc.,MDT,"Harrisburg, PA: Harrisburg International",111,19,13,1,0,0,5,0,0,1639,1296,17,0,0,
2021,11,OO,SkyWest Airlines Inc.,MDW,"Chicago, IL: Chicago Midway International",1,0,0,0,0,0,0,0,0,0,0,0,0,0,
2021,11,OO,SkyWest Airlines Inc.,MEI,"Meridian, MS: Key Field",51,4,4,0,0,0,0,0,0,1002,1002,0,0,0,
2021,11,OO,SkyWest Airlines Inc.,MEM,"Memphis, TN: Memphis International",426,57,39,9,0,0,9,0,0,3615,1891,1094,0,0,
2021,11,OO,SkyWest Airlines Inc.,MFE,"Mission/McAllen/Edinburg, TX: McAllen Miller International",27,1,1,0,0,0,0,0,0,868,868,0,0,0,
2021,11,OO,SkyWest Airlines Inc.,MFR,"Medford, OR: Rogue Valley International - Medford",390,64,37,8,1,0,18,0,0,4006,2433,423,20,0,
2021,11,OO,SkyWest Airlines Inc.,MHK,"Manhattan/Ft. Riley, KS: Manhattan Regional",61,6,3,0,0,0,3,0,0,220,128,0,0,0,
2021,11,OO,SkyWest Airlines Inc.,MHT,"Manchester, NH: Manchester-Boston Regional",13,1,1,0,0,0,0,0,0,17,17,0,0,0,
2021,11,OO,SkyWest Airlines Inc.,MKE,"Milwaukee, WI: General Mitchell International",289,41,27,1,0,0,13,1,0,2096,1160,21,0,0,
2021,11,OO,SkyWest Airlines Inc.,MKG,"Muskegon, MI: Muskegon County",51,6,6,0,0,0,0,1,0,242,242,0,0,0,
2021,11,OO,SkyWest Airlines Inc.,MLI,"Moline, IL: Quad City International",59,5,5,0,0,0,0,0,0,176,176,0,0,0,
2021,11,OO,SkyWest Airlines Inc.,MOB,"Mobile, AL: Mobile Regional",12,2,2,0,0,0,0,0,0,102,102,0,0,0,
2021,11,OO,SkyWest Airlines Inc.,MOT,"Minot, ND: Minot International",170,27,23,4,0,0,0,0,0,2602,1974,628,0,0,
2021,11,OO,SkyWest Airlines Inc.,MQT,"Marquette, MI: Sawyer International",77,13,12,1,0,0,0,0,0,1022,958,64,0,0,
2021,11,OO,SkyWest Airlines Inc.,MRY,"Monterey, CA: Monterey Regional",173,21,15,1,0,0,5,3,0,1247,727,31,0,0,
2021,11,OO,SkyWest Airlines Inc.,MSN,"Madison, WI: Dane County Regional-Truax Field",304,58,39,5,0,0,14,0,0,4624,3112,261,0,0,
2021,11,OO,SkyWest Airlines Inc.,MSO,"Missoula, MT: Missoula International",117,11,11,0,0,0,0,0,0,1568,1568,0,0,0,
2021,11,OO,SkyWest Airlines Inc.,MSP,"Minneapolis, MN: Minneapolis-St Paul International",2946,307,223,78,0,2,4,3,1,29403,21095,7500,0,37,
2021,11,OO,SkyWest Airlines Inc.,MSY,"New Orleans, LA: Louis Armstrong New Orleans International",33,6,6,0,0,0,0,1,0,163,163,0,0,0,
2021,11,OO,SkyWest Airlines Inc.,MTJ,"Montrose/Delta, CO: Montrose Regional",87,10,6,0,0,0,4,0,0,814,471,0,0,0,
2021,11,OO,SkyWest Airlines Inc.,MYR,"Myrtle Beach, SC: Myrtle Beach International",1,1,0,0,0,0,1,0,0,71,0,0,0,0,
2021,11,OO,SkyWest Airlines Inc.,OAK,"Oakland, CA: Metropolitan Oakland International",188,34,18,12,2,0,2,0,1,2083,999,907,136,0,
2021,11,OO,SkyWest Airlines Inc.,OGS,"Ogdensburg, NY: Ogdensburg International",49,11,9,0,0,0,2,2,1,1440,1130,0,0,0,
2021,11,OO,SkyWest Airlines Inc.,OKC,"Oklahoma City, OK: Will Rogers World",573,80,54,2,0,1,23,1,0,5773,3808,56,0,34,
2021,11,OO,SkyWest Airlines Inc.,OMA,"Omaha, NE: Eppley Airfield",536,56,46,8,0,0,2,1,0,3929,3187,476,0,0,
2021,11,OO,SkyWest Airlines Inc.,ONT,"Ontario, CA: Ontario International",298,25,18,2,0,0,5,0,1,1124,629,103,0,0,
2021,11,OO,SkyWest Airlines Inc.,ORD,"Chicago, IL: Chicago O'Hare International",5829,712,462,12,8,0,230,30,1,67829,40732,491,923,0,
2021,11,OO,SkyWest Airlines Inc.,ORF,"Norfolk, VA: Norfolk International",93,21,15,4,0,0,2,0,1,1704,814,692,0,0,
2021,11,OO,SkyWest Airlines Inc.,OTH,"North Bend/Coos Bay, OR: Southwest Oregon Regional",22,8,7,0,0,0,1,1,3,848,797,0,0,0,
2021,11,OO,SkyWest Airlines Inc.,PAH,"Paducah, KY: Barkley Regional",59,7,3,0,0,0,4,0,0,466,92,0,0,0,
2021,11,OO,SkyWest Airlines Inc.,PBG,"Plattsburgh, NY: Plattsburgh International",49,12,10,2,0,0,0,1,0,2855,2784,71,0,0,
2021,11,OO,SkyWest Airlines Inc.,PDX,"Portland, OR: Portland International",805,124,60,14,0,1,49,5,2,6701,3172,602,0,16,
2021,11,OO,SkyWest Airlines Inc.,PHL,"Philadelphia, PA: Philadelphia International",57,17,13,4,0,0,0,0,0,2832,2157,675,0,0,
2021,11,OO,SkyWest Airlines Inc.,PHX,"Phoenix, AZ: Phoenix Sky Harbor International",1704,219,92,16,2,1,108,6,0,21991,9515,1692,134,36,
2021,11,OO,SkyWest Airlines Inc.,PIB,"Hattiesburg/Laurel, MS: Hattiesburg-Laurel Regional",51,11,8,0,0,0,3,0,0,1447,430,0,0,0,
2021,11,OO,SkyWest Airlines Inc.,PIH,"Pocatello, ID: Pocatello Regional",30,0,0,0,0,0,0,0,0,0,0,0,0,0,
2021,11,OO,SkyWest Airlines Inc.,PIR,"Pierre, SD: Pierre Regional",51,3,3,0,0,0,0,0,0,1441,1441,0,0,0,
2021,11,OO,SkyWest Airlines Inc.,PIT,"Pittsburgh, PA: Pittsburgh International",239,40,26,5,1,0,8,0,0,2226,1107,266,59,0,
2021,11,OO,SkyWest Airlines Inc.,PLN,"Pellston, MI: Pellston Regional Airport of Emmet County",50,11,10,1,0,0,0,0,0,2444,1301,1143,0,0,
2021,11,OO,SkyWest Airlines Inc.,PNS,"Pensacola, FL: Pensacola International",3,0,0,0,0,0,0,0,0,0,0,0,0,0,
2021,11,OO,SkyWest Airlines Inc.,PRC,"Prescott, AZ: Prescott Regional Ernest A Love Field",67,6,4,0,0,0,2,0,0,332,120,0,0,0,
2021,11,OO,SkyWest Airlines Inc.,PSC,"Pasco/Kennewick/Richland, WA: Tri Cities",294,39,32,4,0,0,3,0,0,3498,2906,256,0,0,
2021,11,OO,SkyWest Airlines Inc.,PSP,"Palm Springs, CA: Palm Springs International",569,86,47,4,0,0,35,3,1,6347,2551,657,0,0,
2021,11,OO,SkyWest Airlines Inc.,PUB,"Pueblo, CO: Pueblo Memorial",51,2,2,0,0,0,0,0,0,37,37,0,0,0,
2021,11,OO,SkyWest Airlines Inc.,PVD,"Providence, RI: Theodore Francis Green State",171,34,19,9,0,0,6,0,0,2362,1078,862,0,0,
2021,11,OO,SkyWest Airlines Inc.,PWM,"Portland, ME: Portland International Jetport",29,7,6,1,0,0,0,0,0,597,504,93,0,0,
2021,11,OO,SkyWest Airlines Inc.,RAP,"Rapid City, SD: Rapid City Regional",203,14,14,0,0,0,0,0,1,644,644,0,0,0,
2021,11,OO,SkyWest Airlines Inc.,RDD,"Redding, CA: Redding Municipal",117,26,19,1,0,0,6,2,0,2634,2186,82,0,0,
2021,11,OO,SkyWest Airlines Inc.,RDM,"Bend/Redmond, OR: Roberts Field",388,39,25,4,0,0,10,0,0,2646,1112,330,0,0,
2021,11,OO,SkyWest Airlines Inc.,RDU,"Raleigh/Durham, NC: Raleigh-Durham International",24,5,2,2,0,0,1,0,0,390,261,75,0,0,
2021,11,OO,SkyWest Airlines Inc.,RHI,"Rhinelander, WI: Rhinelander/Oneida County",60,5,4,1,0,0,0,0,0,179,162,17,0,0,
2021,11,OO,SkyWest Airlines Inc.,RIC,"Richmond, VA: Richmond International",151,27,17,3,0,0,7,0,0,2388,1577,339,0,0,
2021,11,OO,SkyWest Airlines Inc.,RIW,"Riverton/Lander, WY: Riverton Regional",59,4,4,0,0,0,0,0,0,748,748,0,0,0,
2021,11,OO,SkyWest Airlines Inc.,RKS,"Rock Springs, WY: Southwest Wyoming Regional",61,4,2,0,0,0,2,0,0,366,182,0,0,0,
2021,11,OO,SkyWest Airlines Inc.,RNO,"Reno, NV: Reno/Tahoe International",459,72,40,8,0,0,24,2,2,4775,3135,298,0,0,
2021,11,OO,SkyWest Airlines Inc.,ROC,"Rochester, NY: Greater Rochester International",61,9,3,0,0,0,6,0,0,1267,110,0,0,0,
2021,11,OO,SkyWest Airlines Inc.,ROW,"Roswell, NM: Roswell International Air Center",86,7,3,1,0,0,3,0,0,528,116,151,0,0,
2021,11,OO,SkyWest Airlines Inc.,RST,"Rochester, MN: Rochester International",67,8,7,1,0,0,0,0,0,994,912,82,0,0,
2021,11,OO,SkyWest Airlines Inc.,SAF,"Santa Fe, NM: Santa Fe Municipal",132,14,1,0,0,0,13,0,0,715,21,0,0,0,
2021,11,OO,SkyWest Airlines Inc.,SAN,"San Diego, CA: San Diego International",699,105,38,6,2,0,59,16,2,8015,2246,790,582,0,
2021,11,OO,SkyWest Airlines Inc.,SAT,"San Antonio, TX: San Antonio International",177,23,13,0,0,0,10,0,0,1155,496,0,0,0,
2021,11,OO,SkyWest Airlines Inc.,SAV,"Savannah, GA: Savannah/Hilton Head International",59,7,6,0,0,0,1,0,0,277,175,0,0,0,
2021,11,OO,SkyWest Airlines Inc.,SBA,"Santa Barbara, CA: Santa Barbara Municipal",198,29,22,2,0,0,5,10,5,3048,1931,781,0,0,
2021,11,OO,SkyWest Airlines Inc.,SBN,"South Bend, IN: South Bend International",267,47,33,7,0,0,7,1,0,4277,1651,1545,0,0,
2021,11,OO,SkyWest Airlines Inc.,SBP,"San Luis Obispo, CA: San Luis County Regional",338,46,29,3,0,0,14,5,1,5259,3466,940,0,0,
2021,11,OO,SkyWest Airlines Inc.,SCE,"State College, PA: University Park",2,1,0,0,0,0,1,0,0,17,0,0,0,0,
2021,11,OO,SkyWest Airlines Inc.,SDF,"Louisville, KY: Louisville Muhammad Ali International",253,36,20,5,0,0,11,0,0,2568,801,679,0,0,
2021,11,OO,SkyWest Airlines Inc.,SEA,"Seattle, WA: Seattle/Tacoma International",1565,146,106,24,3,0,13,3,3,8021,5808,1265,87,0,
2021,11,OO,SkyWest Airlines Inc.,SFO,"San Francisco, CA: San Francisco International",2814,386,208,33,21,0,124,41,14,34578,22542,2097,1533,0,
2021,11,OO,SkyWest Airlines Inc.,SGF,"Springfield, MO: Springfield-Branson National",29,3,3,0,0,0,0,0,0,61,61,0,0,0,
2021,11,OO,SkyWest Airlines Inc.,SGU,"St. George, UT: St George Regional",264,18,12,2,0,0,4,0,0,832,437,83,0,0,
2021,11,OO,SkyWest Airlines Inc.,SHD,"Staunton, VA: Shenandoah Valley Regional",58,14,13,0,0,0,1,0,0,446,385,0,0,0,
2021,11,OO,SkyWest Airlines Inc.,SHR,"Sheridan, WY: Sheridan County",51,4,4,0,0,0,0,0,1,380,380,0,0,0,
2021,11,OO,SkyWest Airlines Inc.,SHV,"Shreveport, LA: Shreveport Regional",39,3,0,0,0,0,3,1,0,95,0,0,0,0,
2021,11,OO,SkyWest Airlines Inc.,SJC,"San Jose, CA: Norman Y. Mineta San Jose International",729,94,38,16,4,0,36,5,2,5648,2347,976,253,0,
2021,11,OO,SkyWest Airlines Inc.,SJT,"San Angelo, TX: San Angelo Regional/Mathis Field",41,4,2,1,0,0,1,0,0,285,76,189,0,0,
2021,11,OO,SkyWest Airlines Inc.,SLC,"Salt Lake City, UT: Salt Lake City International",3629,300,207,48,5,1,39,1,1,26977,19494,4732,113,19,
2021,11,OO,SkyWest Airlines Inc.,SLN,"Salina, KS: Salina Regional",58,5,5,0,0,0,0,0,1,260,260,0,0,0,
2021,11,OO,SkyWest Airlines Inc.,SMF,"Sacramento, CA: Sacramento International",593,115,64,24,2,0,25,4,1,9439,6615,1054,97,0,
2021,11,OO,SkyWest Airlines Inc.,SNA,"Santa Ana, CA: John Wayne Airport-Orange County",166,19,9,0,0,0,10,1,1,835,286,0,0,0,
2021,11,OO,SkyWest Airlines Inc.,SRQ,"Sarasota/Bradenton, FL: Sarasota/Bradenton International",60,9,8,0,0,0,1,0,1,365,334,0,0,0,
2021,11,OO,SkyWest Airlines Inc.,STL,"St. Louis, MO: St Louis Lambert International",295,57,47,7,0,0,3,1,0,3358,2773,500,0,0,
2021,11,OO,SkyWest Airlines Inc.,STS,"Santa Rosa, CA: Charles M. Schulz - Sonoma County",234,42,15,0,1,0,26,12,3,4419,2458,0,17,0,
2021,11,OO,SkyWest Airlines Inc.,SUN,"Sun Valley/Hailey/Ketchum, ID: Friedman Memorial",117,8,8,0,0,0,0,0,1,226,226,0,0,0,
2021,11,OO,SkyWest Airlines Inc.,SUX,"Sioux City, IA: Sioux Gateway Brig Gen Bud Day Field",62,7,7,0,0,0,0,0,0,210,210,0,0,0,
2021,11,OO,SkyWest Airlines Inc.,SYR,"Syracuse, NY: Syracuse Hancock International",112,16,12,1,0,0,3,0,0,717,441,45,0,0,
2021,11,OO,SkyWest Airlines Inc.,TBN,"Fort Leonard Wood, MO: Waynesville-St. Robert Regional Forney Field",49,1,1,0,0,0,0,1,0,90,90,0,0,0,
2021,11,OO,SkyWest Airlines Inc.,TOL,"Toledo, OH: Toledo Express",2,0,0,0,0,0,0,0,0,0,0,0,0,0,
2021,11,OO,SkyWest Airlines Inc.,TRI,"Bristol/Johnson City/Kingsport, TN: Tri Cities",58,12,4,0,0,1,7,0,0,607,192,0,0,81,
2021,11,OO,SkyWest Airlines Inc.,TUL,"Tulsa, OK: Tulsa International",327,33,27,0,1,1,4,0,0,3164,2640,0,157,33,
2021,11,OO,SkyWest Airlines Inc.,TUS,"Tucson, AZ: Tucson International",573,73,44,15,0,0,14,0,0,5539,3931,562,0,0,
2021,11,OO,SkyWest Airlines Inc.,TVC,"Traverse City, MI: Cherry Capital",122,24,18,5,0,0,1,0,0,2189,1960,197,0,0,
2021,11,OO,SkyWest Airlines Inc.,TWF,"Twin Falls, ID: Joslin Field - Magic Valley Regional",60,3,3,0,0,0,0,0,0,333,333,0,0,0,
2021,11,OO,SkyWest Airlines Inc.,TYS,"Knoxville, TN: McGhee Tyson",118,17,16,0,0,0,1,0,0,1325,1261,0,0,0,
2021,11,OO,SkyWest Airlines Inc.,VCT,"Victoria, TX: Victoria Regional",51,0,0,0,0,0,0,1,0,0,0,0,0,0,
2021,11,OO,SkyWest Airlines Inc.,VEL,"Vernal, UT: Vernal Regional",51,1,0,0,0,0,1,0,0,46,0,0,0,0,
2021,11,OO,SkyWest Airlines Inc.,XNA,"Fayetteville, AR: Northwest Arkansas Regional",103,15,8,0,1,1,5,0,1,1471,974,0,137,71,
2021,11,OO,SkyWest Airlines Inc.,XWA,"Williston, ND: Williston Basin International",119,12,9,3,0,0,0,0,1,1283,395,888,0,0,
2021,11,OO,SkyWest Airlines Inc.,YUM,"Yuma, AZ: Yuma MCAS/Yuma International",120,9,5,0,0,0,4,1,0,403,150,0,0,0,
2021,11,QX,Horizon Air,ABQ,"Albuquerque, NM: Albuquerque International Sunport",14,0,0,0,0,0,0,0,0,0,0,0,0,0,
2021,11,QX,Horizon Air,AKN,"King Salmon, AK: King Salmon Airport",29,6,2,1,0.92,0,2.08,2,0,262,78,18,50,0,
2021,11,QX,Horizon Air,ALW,"Walla Walla, WA: Walla Walla Regional",55,7,1,1,1,0,4,0,1,259,48,32,19,0,
2021,11,QX,Horizon Air,ANC,"Anchorage, AK: Ted Stevens Anchorage International",224,72,6.77,1.86,14.46,8.61,40.3,7,0,4047,462,118,509,247,
2021,11,QX,Horizon Air,BIL,"Billings, MT: Billings Logan International",60,4,3.4,0,0.6,0,0,0,1,212,203,0,9,0,
2021,11,QX,Horizon Air,BLI,"Bellingham, WA: Bellingham International",129,12,6.38,0,1.71,0,3.92,0,0,489,227,0,65,0,
2021,11,QX,Horizon Air,BOI,"Boise, ID: Boise Air Terminal",427,39,15.33,1.81,8.71,0,13.15,1,0,1628,542,86,211,0,
2021,11,QX,Horizon Air,BZN,"Bozeman, MT: Bozeman Yellowstone International",59,4,2.17,0,0.11,0,1.71,0,0,168,82,0,8,0,
2021,11,QX,Horizon Air,DLG,"Dillingham, AK: Dillingham Airport",29,7,1.4,0,1.23,0,4.37,0,0,419,86,0,46,0,
2021,11,QX,Horizon Air,EAT,"Wenatchee, WA: Pangborn Memorial",50,2,0,0,0,0,2,2,0,98,0,0,0,0,
2021,11,QX,Horizon Air,ELP,"El Paso, TX: El Paso International",29,2,2,0,0,0,0,0,0,88,88,0,0,0,
2021,11,QX,Horizon Air,EUG,"Eugene, OR: Mahlon Sweet Field",165,23,10.69,0.03,5.68,0,6.6,0,0,683,280,2,134,0,
2021,11,QX,Horizon Air,FAI,"Fairbanks, AK: Fairbanks International",137,45,15.01,1.46,13.59,0,14.93,4,0,2570,1236,59,490,0,
2021,11,QX,Horizon Air,FAT,"Fresno, CA: Fresno Yosemite International",70,13,4.45,0,6.59,0,1.96,0,0,430,208,0,140,0,
2021,11,QX,Horizon Air,FCA,"Kalispell, MT: Glacier Park International",54,4,1,1,1,0,1,0,0,88,15,17,24,0,
2021,11,QX,Horizon Air,GEG,"Spokane, WA: Spokane International",470,43,26.39,0,4.24,0,12.37,0,0,1829,1165,0,120,0,
2021,11,QX,Horizon Air,GTF,"Great Falls, MT: Great Falls International",30,3,2.06,0,0.94,0,0,0,0,95,71,0,24,0,
2021,11,QX,Horizon Air,HLN,"Helena, MT: Helena Regional",29,2,0,0,0,0,2,0,0,155,0,0,0,0,
2021,11,QX,Horizon Air,ICT,"Wichita, KS: Wichita Dwight D Eisenhower National",27,2,2,0,0,0,0,0,0,108,108,0,0,0,
2021,11,QX,Horizon Air,IDA,"Idaho Falls, ID: Idaho Falls Regional",29,6,3.31,0,0.05,0,2.65,0,0,227,139,0,1,0,
2021,11,QX,Horizon Air,LAS,"Las Vegas, NV: McCarran International",86,9,4.12,0,3.9,0,0.98,0,0,445,167,0,157,0,
2021,11,QX,Horizon Air,LAX,"Los Angeles, CA: Los Angeles International",243,26,5.97,0,11.04,0,8.98,1,0,1749,876,0,327,0,
2021,11,QX,Horizon Air,MFR,"Medford, OR: Rogue Valley International - Medford",161,22,9.89,0.73,8.75,0,2.63,0,1,605,258,16,216,0,
2021,11,QX,Horizon Air,MRY,"Monterey, CA: Monterey Regional",35,2,1.06,0,0.42,0,0.53,0,0,33,17,0,7,0,
2021,11,QX,Horizon Air,MSO,"Missoula, MT: Missoula International",100,8,3.99,1,1.17,0,1.84,0,0,275,103,92,27,0,
2021,11,QX,Horizon Air,MSP,"Minneapolis, MN: Minneapolis-St Paul International",10,0,0,0,0,0,0,1,0,0,0,0,0,0,
2021,11,QX,Horizon Air,OAK,"Oakland, CA: Metropolitan Oakland International",49,7,1.67,0,3.22,0,2.1,0,0,239,54,0,68,0,
2021,11,QX,Horizon Air,ONT,"Ontario, CA: Ontario International",15,2,1.95,0,0.05,0,0,0,0,108,104,0,4,0,
2021,11,QX,Horizon Air,ORD,"Chicago, IL: Chicago O'Hare International",26,2,0,0,1,0,1,0,0,44,0,0,16,0,
2021,11,QX,Horizon Air,PAE,"Everett, WA: Snohomish County",163,20,8.16,0,5.35,0,6.49,0,0,1009,250,0,115,0,
2021,11,QX,Horizon Air,PDX,"Portland, OR: Portland International",677,64,22.74,0,16.21,0,25.05,1,0,2939,1601,0,370,0,
2021,11,QX,Horizon Air,PHX,"Phoenix, AZ: Phoenix Sky Harbor International",72,10,7.98,0,1.13,0,0.89,0,0,745,675,0,30,0,
2021,11,QX,Horizon Air,PSC,"Pasco/Kennewick/Richland, WA: Tri Cities",123,11,5.67,0,0.66,0,4.67,0,0,432,168,0,13,0,
2021,11,QX,Horizon Air,PSP,"Palm Springs, CA: Palm Springs International",51,6,3.95,0,1.09,0,0.96,0,0,159,117,0,20,0,
2021,11,QX,Horizon Air,PUW,"Pullman, WA: Pullman Moscow Regional",79,8,4.23,0,1.77,0,2,1,0,281,116,0,51,0,
2021,11,QX,Horizon Air,RDD,"Redding, CA: Redding Municipal",29,5,3.01,0,1.19,0,0.8,0,0,107,58,0,25,0,
2021,11,QX,Horizon Air,RDM,"Bend/Redmond, OR: Roberts Field",174,21,9.22,0.91,4,0,6.86,1,1,1039,409,85,91,0,
2021,11,QX,Horizon Air,RNO,"Reno, NV: Reno/Tahoe International",82,13,5.05,0,3.85,0,4.1,0,0,371,122,0,75,0,
2021,11,QX,Horizon Air,SAN,"San Diego, CA: San Diego International",153,15,4.36,0.35,7.62,0,2.67,4,2,791,324,9,274,0,
2021,11,QX,Horizon Air,SBA,"Santa Barbara, CA: Santa Barbara Municipal",72,7,4.18,0,2.58,0,0.24,0,1,328,224,0,98,0,
2021,11,QX,Horizon Air,SBP,"San Luis Obispo, CA: San Luis County Regional",38,2,2,0,0,0,0,0,0,275,275,0,0,0,
2021,11,QX,Horizon Air,SEA,"Seattle, WA: Seattle/Tacoma International",2304,244,60.47,9.98,89.68,0,83.87,10,6,12812,3942,498,2703,0,
2021,11,QX,Horizon Air,SFO,"San Francisco, CA: San Francisco International",266,24,2.1,1,8.78,0,12.12,2,0,1552,100,127,345,0,
2021,11,QX,Horizon Air,SJC,"San Jose, CA: Norman Y. Mineta San Jose International",132,8,2.12,0.33,2.27,0,3.28,0,0,309,53,19,75,0,
2021,11,QX,Horizon Air,SLC,"Salt Lake City, UT: Salt Lake City International",57,14,5.61,0,3.21,0,5.18,1,0,992,348,0,108,0,
2021,11,QX,Horizon Air,SMF,"Sacramento, CA: Sacramento International",79,12,5.76,0,3.03,0,3.21,3,0,521,324,0,112,0,
2021,11,QX,Horizon Air,SNA,"Santa Ana, CA: John Wayne Airport-Orange County",98,14,3.02,0,7.26,0,3.72,1,0,492,85,0,161,0,
2021,11,QX,Horizon Air,STS,"Santa Rosa, CA: Charles M. Schulz - Sonoma County",122,20,5.4,3,6.49,0,5.1,3,3,752,349,91,155,0,
2021,11,QX,Horizon Air,SUN,"Sun Valley/Hailey/Ketchum, ID: Friedman Memorial",8,0,0,0,0,0,0,0,0,0,0,0,0,0,
2021,11,QX,Horizon Air,TUS,"Tucson, AZ: Tucson International",12,0,0,0,0,0,0,0,0,0,0,0,0,0,
2021,11,QX,Horizon Air,YKM,"Yakima, WA: Yakima Air Terminal/McAllister Field",55,9,3.99,0.74,0.28,0,4,1,0,537,404,28,12,0,
2021,11,UA,United Air Lines Inc.,ABQ,"Albuquerque, NM: Albuquerque International Sunport",64,5,2.99,0,0.06,0,1.95,0,0,260,94,0,1,0,
2021,11,UA,United Air Lines Inc.,ALB,"Albany, NY: Albany International",29,5,1.04,0,0.11,0,3.85,0,0,357,31,0,14,0,
2021,11,UA,United Air Lines Inc.,ANC,"Anchorage, AK: Ted Stevens Anchorage International",30,5,2.47,0,2.39,0,0.14,0,0,147,68,0,71,0,
2021,11,UA,United Air Lines Inc.,ATL,"Atlanta, GA: Hartsfield-Jackson Atlanta International",226,43,22.07,0,6.42,0,14.5,2,0,2651,1336,0,275,0,
2021,11,UA,United Air Lines Inc.,AUS,"Austin, TX: Austin - Bergstrom International",753,90,35.73,1.58,16.71,0,35.98,4,2,5088,2226,37,608,0,
2021,11,UA,United Air Lines Inc.,BDL,"Hartford, CT: Bradley International",150,12,3.66,0,2.55,0,5.78,1,0,613,100,0,114,0,
2021,11,UA,United Air Lines Inc.,BHM,"Birmingham, AL: Birmingham-Shuttlesworth International",2,0,0,0,0,0,0,0,0,0,0,0,0,0,
2021,11,UA,United Air Lines Inc.,BIL,"Billings, MT: Billings Logan International",61,11,6.7,0,0.47,0,3.83,0,0,563,226,0,12,0,
2021,11,UA,United Air Lines Inc.,BNA,"Nashville, TN: Nashville International",211,35,16.54,0,8.47,0,9.99,1,0,1312,712,0,201,0,
2021,11,UA,United Air Lines Inc.,BOI,"Boise, ID: Boise Air Terminal",77,12,5.71,0,2.46,0,3.83,0,0,408,146,0,49,0,
2021,11,UA,United Air Lines Inc.,BOS,"Boston, MA: Logan International",913,119,46.94,2,24.49,0,45.57,4,2,6932,2264,146,1089,0,
2021,11,UA,United Air Lines Inc.,BQN,"Aguadilla, PR: Rafael Hernandez",30,15,8.31,0,5.18,0,1.51,0,0,654,367,0,215,0,
2021,11,UA,United Air Lines Inc.,BTR,"Baton Rouge, LA: Baton Rouge Metropolitan/Ryan Field",2,0,0,0,0,0,0,0,0,0,0,0,0,0,
2021,11,UA,United Air Lines Inc.,BTV,"Burlington, VT: Burlington International",1,0,0,0,0,0,0,0,0,0,0,0,0,0,
2021,11,UA,United Air Lines Inc.,BUF,"Buffalo, NY: Buffalo Niagara International",57,16,4.08,0,1.61,0,10.31,1,0,1009,128,0,34,0,
2021,11,UA,United Air Lines Inc.,BUR,"Burbank, CA: Bob Hope",29,1,0,0,0,0,1,0,0,75,0,0,0,0,
2021,11,UA,United Air Lines Inc.,BWI,"Baltimore, MD: Baltimore/Washington International Thurgood Marshall",235,26,12.15,0,6,0,7.85,1,0,1402,652,0,147,0,
2021,11,UA,United Air Lines Inc.,BZN,"Bozeman, MT: Bozeman Yellowstone International",62,12,5.43,0,2.14,0,4.43,0,0,402,135,0,52,0,
2021,11,UA,United Air Lines Inc.,CHS,"Charleston, SC: Charleston AFB/International",71,23,7.53,0,5.55,0,9.92,2,0,1359,344,0,192,0,
2021,11,UA,United Air Lines Inc.,CID,"Cedar Rapids/Iowa City, IA: The Eastern Iowa",30,3,1.67,0,0.33,0,1,0,0,189,66,0,5,0,
2021,11,UA,United Air Lines Inc.,CLE,"Cleveland, OH: Cleveland-Hopkins International",747,111,42.11,0,19.66,0,49.23,2,1,5480,1694,0,547,0,
2021,11,UA,United Air Lines Inc.,CLT,"Charlotte, NC: Charlotte Douglas International",48,9,3.85,0,0.61,0,4.53,2,0,533,186,0,36,0,
2021,11,UA,United Air Lines Inc.,CMH,"Columbus, OH: John Glenn Columbus International",86,17,5.57,0,8.05,0,3.38,0,0,587,187,0,162,0,
2021,11,UA,United Air Lines Inc.,COS,"Colorado Springs, CO: City of Colorado Springs Municipal",103,19,6.61,0,1.68,0,10.72,0,0,1283,308,0,146,0,
2021,11,UA,United Air Lines Inc.,CVG,"Cincinnati, OH: Cincinnati/Northern Kentucky International",83,14,6.65,0,3.66,0,3.69,0,0,497,160,0,134,0,
2021,11,UA,United Air Lines Inc.,DCA,"Washington, DC: Ronald Reagan Washington National",196,30,11.01,0,11.24,0,7.75,2,0,1142,397,0,351,0,
2021,11,UA,United Air Lines Inc.,DEN,"Denver, CO: Denver International",5989,609,237.66,7.2,179.1,0,185.04,21,1,33732,14313,275,4697,0,
2021,11,UA,United Air Lines Inc.,DFW,"Dallas/Fort Worth, TX: Dallas/Fort Worth International",447,59,25.04,1.33,9.06,0,23.57,1,1,3308,1475,76,252,0,
2021,11,UA,United Air Lines Inc.,DSM,"Des Moines, IA: Des Moines International",88,14,7.23,0,0.4,0,6.37,0,0,739,270,0,24,0,
2021,11,UA,United Air Lines Inc.,DTW,"Detroit, MI: Detroit Metro Wayne County",58,15,3.95,0,1.77,0,9.28,1,0,949,252,0,87,0,
